root@ubuntu-s-1vcpu-1gb-tor1-01:~# tcpdump -i eth0

06:56:03.051843 IP ubuntu-s-1vcpu-1gb-tor1-01.ssh > 162.243.188.66.2328: Flags [P.], seq 64528:64768, ack 1, win 502, options [nop,nop,TS val 1107905042 ecr 4160161368], length 240
06:56:03.051893 IP ubuntu-s-1vcpu-1gb-tor1-01.ssh > 162.243.188.66.2328: Flags [P.], seq 64768:64832, ack 1, win 502, options [nop,nop,TS val 1107905042 ecr 4160161368], length 64
06:56:03.051947 IP ubuntu-s-1vcpu-1gb-tor1-01.ssh > 162.243.188.66.2328: Flags [P.], seq 64832:65136, ack 1, win 502, options [nop,nop,TS val 1107905042 ecr 4160161368], length 304
06:56:03.051997 IP ubuntu-s-1vcpu-1gb-tor1-01.ssh > 162.243.188.66.2328: Flags [P.], seq 65136:65376, ack 1, win 502, options [nop,nop,TS val 1107905042 ecr 4160161368], length 240
06:56:03.052047 IP ubuntu-s-1vcpu-1gb-tor1-01.ssh > 162.243.188.66.2328: Flags [P.], seq 65376:65440, ack 1, win 502, options [nop,nop,TS val 1107905043 ecr 4160161368], length 64
06:56:03.052097 IP ubuntu-s-1vcpu-1gb-tor1-01.ssh > 162.243.188.66.2328: Flags [P.], seq 65440:65680, ack 1, win 502, options [nop,nop,TS val 1107905043 ecr 4160161368], length 240
06:56:03.052148 IP ubuntu-s-1vcpu-1gb-tor1-01.ssh > 162.243.188.66.2328: Flags [P.], seq 65680:65744, ack 1, win 502, options [nop,nop,TS val 1107905043 ecr 4160161368], length 64
06:56:03.052200 IP ubuntu-s-1vcpu-1gb-tor1-01.ssh > 162.243.188.66.2328: Flags [P.], seq 65744:66048, ack 1, win 502, options [nop,nop,TS val 1107905043 ecr 4160161368], length 304
06:56:03.052301 IP ubuntu-s-1vcpu-1gb-tor1-01.ssh > 162.243.188.66.2328: Flags [P.], seq 66048:66352, ack 1, win 502, options [nop,nop,TS val 1107905043 ecr 4160161368], length 304
06:56:03.052369 IP ubuntu-s-1vcpu-1gb-tor1-01.ssh > 162.243.188.66.2328: Flags [P.], seq 66352:66656, ack 1, win 502, options [nop,nop,TS val 1107905043 ecr 4160161368], length 304
06:56:03.052434 IP ubuntu-s-1vcpu-1gb-tor1-01.ssh > 162.243.188.66.2328: Flags [P.], seq 66656:66896, ack 1, win 502, options [nop,nop,TS val 1107905043 ecr 4160161368], length 240
06:56:03.052501 IP ubuntu-s-1vcpu-1gb-tor1-01.ssh > 162.243.188.66.2328: Flags [P.], seq 66896:66960, ack 1, win 502, options [nop,nop,TS val 1107905043 ecr 4160161368], length 64
06:56:03.052541 IP ubuntu-s-1vcpu-1gb-tor1-01.ssh > 162.243.188.66.2328: Flags [P.], seq 66960:67200, ack 1, win 502, options [nop,nop,TS val 1107905043 ecr 4160161368], length 240
06:56:03.052608 IP ubuntu-s-1vcpu-1gb-tor1-01.ssh > 162.243.188.66.2328: Flags [P.], seq 67200:67504, ack 1, win 502, options [nop,nop,TS val 1107905043 ecr 4160161368], length 304
06:56:03.052672 IP ubuntu-s-1vcpu-1gb-tor1-01.ssh > 162.243.188.66.2328: Flags [P.], seq 67504:67808, ack 1, win 502, options [nop,nop,TS val 1107905043 ecr 4160161368], length 304
06:56:03.052733 IP ubuntu-s-1vcpu-1gb-tor1-01.ssh > 162.243.188.66.2328: Flags [P.], seq 67808:68176, ack 1, win 502, options [nop,nop,TS val 1107905043 ecr 4160161368], length 368
06:56:03.052805 IP ubuntu-s-1vcpu-1gb-tor1-01.ssh > 162.243.188.66.2328: Flags [P.], seq 68176:68416, ack 1, win 502, options [nop,nop,TS val 1107905043 ecr 4160161368], length 240
06:56:03.052869 IP ubuntu-s-1vcpu-1gb-tor1-01.ssh > 162.243.188.66.2328: Flags [P.], seq 68416:68720, ack 1, win 502, options [nop,nop,TS val 1107905043 ecr 4160161368], length 304
06:56:03.052942 IP ubuntu-s-1vcpu-1gb-tor1-01.ssh > 162.243.188.66.2328: Flags [P.], seq 68720:69328, ack 1, win 502, options [nop,nop,TS val 1107905043 ecr 4160161368], length 608
06:56:03.053022 IP ubuntu-s-1vcpu-1gb-tor1-01.ssh > 162.243.188.66.2328: Flags [P.], seq 69328:69936, ack 1, win 502, options [nop,nop,TS val 1107905043 ecr 4160161368], length 608
06:56:03.053091 IP ubuntu-s-1vcpu-1gb-tor1-01.ssh > 162.243.188.66.2328: Flags [P.], seq 69936:70176, ack 1, win 502, options [nop,nop,TS val 1107905044 ecr 4160161368], length 240
06:56:03.053169 IP ubuntu-s-1vcpu-1gb-tor1-01.ssh > 162.243.188.66.2328: Flags [P.], seq 70176:70592, ack 1, win 502, options [nop,nop,TS val 1107905044 ecr 4160161368], length 416
06:56:03.053245 IP ubuntu-s-1vcpu-1gb-tor1-01.ssh > 162.243.188.66.2328: Flags [P.], seq 70592:71376, ack 1, win 502, options [nop,nop,TS val 1107905044 ecr 4160161368], length 784
06:56:03.053317 IP ubuntu-s-1vcpu-1gb-tor1-01.ssh > 162.243.188.66.2328: Flags [P.], seq 71376:71792, ack 1, win 502, options [nop,nop,TS val 1107905044 ecr 4160161368], length 416
06:56:03.053391 IP ubuntu-s-1vcpu-1gb-tor1-01.ssh > 162.243.188.66.2328: Flags [P.], seq 71792:72032, ack 1, win 502, options [nop,nop,TS val 1107905044 ecr 4160161368], length 240
06:56:03.053574 IP ubuntu-s-1vcpu-1gb-tor1-01.ssh > 162.243.188.66.2328: Flags [P.], seq 72032:72272, ack 1, win 502, options [nop,nop,TS val 1107905044 ecr 4160161368], length 240
06:56:03.053857 IP ubuntu-s-1vcpu-1gb-tor1-01.ssh > 162.243.188.66.2328: Flags [P.], seq 72272:73968, ack 1, win 502, options [nop,nop,TS val 1107905044 ecr 4160161368], length 1696
06:56:03.054129 IP ubuntu-s-1vcpu-1gb-tor1-01.ssh > 162.243.188.66.2328: Flags [P.], seq 73968:74384, ack 1, win 502, options [nop,nop,TS val 1107905045 ecr 4160161368], length 416
06:56:03.054223 IP ubuntu-s-1vcpu-1gb-tor1-01.ssh > 162.243.188.66.2328: Flags [P.], seq 74384:74448, ack 1, win 502, options [nop,nop,TS val 1107905045 ecr 4160161368], length 64
06:56:03.054237 IP ubuntu-s-1vcpu-1gb-tor1-01.ssh > 162.243.188.66.2328: Flags [P.], seq 74448:74688, ack 1, win 502, options [nop,nop,TS val 1107905045 ecr 4160161368], length 240
06:56:03.054299 IP ubuntu-s-1vcpu-1gb-tor1-01.ssh > 162.243.188.66.2328: Flags [P.], seq 74688:74752, ack 1, win 502, options [nop,nop,TS val 1107905045 ecr 4160161368], length 64
06:56:03.054350 IP ubuntu-s-1vcpu-1gb-tor1-01.ssh > 162.243.188.66.2328: Flags [P.], seq 74752:74992, ack 1, win 502, options [nop,nop,TS val 1107905045 ecr 4160161368], length 240
06:56:03.054403 IP ubuntu-s-1vcpu-1gb-tor1-01.ssh > 162.243.188.66.2328: Flags [P.], seq 74992:75056, ack 1, win 502, options [nop,nop,TS val 1107905045 ecr 4160161368], length 64
06:56:03.054453 IP ubuntu-s-1vcpu-1gb-tor1-01.ssh > 162.243.188.66.2328: Flags [P.], seq 75056:75472, ack 1, win 502, options [nop,nop,TS val 1107905045 ecr 4160161368], length 416
06:56:03.054504 IP ubuntu-s-1vcpu-1gb-tor1-01.ssh > 162.243.188.66.2328: Flags [P.], seq 75472:75712, ack 1, win 502, options [nop,nop,TS val 1107905045 ecr 4160161368], length 240
06:56:03.054557 IP ubuntu-s-1vcpu-1gb-tor1-01.ssh > 162.243.188.66.2328: Flags [P.], seq 75712:75776, ack 1, win 502, options [nop,nop,TS val 1107905045 ecr 4160161368], length 64
06:56:03.054837 IP ubuntu-s-1vcpu-1gb-tor1-01.ssh > 162.243.188.66.2328: Flags [P.], seq 75776:76016, ack 1, win 502, options [nop,nop,TS val 1107905045 ecr 4160161368], length 240
06:56:03.054924 IP ubuntu-s-1vcpu-1gb-tor1-01.ssh > 162.243.188.66.2328: Flags [P.], seq 76016:76256, ack 1, win 502, options [nop,nop,TS val 1107905045 ecr 4160161368], length 240
06:56:03.054989 IP ubuntu-s-1vcpu-1gb-tor1-01.ssh > 162.243.188.66.2328: Flags [P.], seq 76256:76320, ack 1, win 502, options [nop,nop,TS val 1107905045 ecr 4160161368], length 64
06:56:03.055029 IP ubuntu-s-1vcpu-1gb-tor1-01.ssh > 162.243.188.66.2328: Flags [P.], seq 76320:76560, ack 1, win 502, options [nop,nop,TS val 1107905045 ecr 4160161368], length 240
06:56:03.055104 IP ubuntu-s-1vcpu-1gb-tor1-01.ssh > 162.243.188.66.2328: Flags [P.], seq 76560:76624, ack 1, win 502, options [nop,nop,TS val 1107905046 ecr 4160161368], length 64
06:56:03.055155 IP ubuntu-s-1vcpu-1gb-tor1-01.ssh > 162.243.188.66.2328: Flags [P.], seq 76624:76864, ack 1, win 502, options [nop,nop,TS val 1107905046 ecr 4160161368], length 240
06:56:03.055228 IP ubuntu-s-1vcpu-1gb-tor1-01.ssh > 162.243.188.66.2328: Flags [P.], seq 76864:76928, ack 1, win 502, options [nop,nop,TS val 1107905046 ecr 4160161368], length 64
06:56:03.055244 IP ubuntu-s-1vcpu-1gb-tor1-01.ssh > 162.243.188.66.2328: Flags [P.], seq 76928:77168, ack 1, win 502, options [nop,nop,TS val 1107905046 ecr 4160161368], length 240
06:56:03.055300 IP ubuntu-s-1vcpu-1gb-tor1-01.ssh > 162.243.188.66.2328: Flags [P.], seq 77168:77232, ack 1, win 502, options [nop,nop,TS val 1107905046 ecr 4160161368], length 64
06:56:03.055354 IP ubuntu-s-1vcpu-1gb-tor1-01.ssh > 162.243.188.66.2328: Flags [P.], seq 77232:77536, ack 1, win 502, options [nop,nop,TS val 1107905046 ecr 4160161368], length 304
06:56:03.055419 IP ubuntu-s-1vcpu-1gb-tor1-01.ssh > 162.243.188.66.2328: Flags [P.], seq 77536:77776, ack 1, win 502, options [nop,nop,TS val 1107905046 ecr 4160161368], length 240
06:56:03.055470 IP ubuntu-s-1vcpu-1gb-tor1-01.ssh > 162.243.188.66.2328: Flags [P.], seq 77776:77840, ack 1, win 502, options [nop,nop,TS val 1107905046 ecr 4160161368], length 64
06:56:03.055521 IP ubuntu-s-1vcpu-1gb-tor1-01.ssh > 162.243.188.66.2328: Flags [P.], seq 77840:78144, ack 1, win 502, options [nop,nop,TS val 1107905046 ecr 4160161368], length 304
06:56:03.055631 IP ubuntu-s-1vcpu-1gb-tor1-01.ssh > 162.243.188.66.2328: Flags [P.], seq 78144:78448, ack 1, win 502, options [nop,nop,TS val 1107905046 ecr 4160161368], length 304
06:56:03.055714 IP ubuntu-s-1vcpu-1gb-tor1-01.ssh > 162.243.188.66.2328: Flags [P.], seq 78448:78688, ack 1, win 502, options [nop,nop,TS val 1107905046 ecr 4160161368], length 240
06:56:03.055779 IP ubuntu-s-1vcpu-1gb-tor1-01.ssh > 162.243.188.66.2328: Flags [P.], seq 78688:78928, ack 1, win 502, options [nop,nop,TS val 1107905046 ecr 4160161368], length 240
06:56:03.055843 IP ubuntu-s-1vcpu-1gb-tor1-01.ssh > 162.243.188.66.2328: Flags [P.], seq 78928:79168, ack 1, win 502, options [nop,nop,TS val 1107905046 ecr 4160161368], length 240
06:56:03.055898 IP ubuntu-s-1vcpu-1gb-tor1-01.ssh > 162.243.188.66.2328: Flags [P.], seq 79168:79472, ack 1, win 502, options [nop,nop,TS val 1107905046 ecr 4160161368], length 304
06:56:03.055972 IP ubuntu-s-1vcpu-1gb-tor1-01.ssh > 162.243.188.66.2328: Flags [P.], seq 79472:79888, ack 1, win 502, options [nop,nop,TS val 1107905046 ecr 4160161368], length 416
06:56:03.056039 IP ubuntu-s-1vcpu-1gb-tor1-01.ssh > 162.243.188.66.2328: Flags [P.], seq 79888:80496, ack 1, win 502, options [nop,nop,TS val 1107905046 ecr 4160161368], length 608
06:56:03.056114 IP ubuntu-s-1vcpu-1gb-tor1-01.ssh > 162.243.188.66.2328: Flags [P.], seq 80496:81104, ack 1, win 502, options [nop,nop,TS val 1107905047 ecr 4160161368], length 608
06:56:03.056195 IP ubuntu-s-1vcpu-1gb-tor1-01.ssh > 162.243.188.66.2328: Flags [P.], seq 81104:81888, ack 1, win 502, options [nop,nop,TS val 1107905047 ecr 4160161368], length 784
06:56:03.056267 IP ubuntu-s-1vcpu-1gb-tor1-01.ssh > 162.243.188.66.2328: Flags [P.], seq 81888:82304, ack 1, win 502, options [nop,nop,TS val 1107905047 ecr 4160161368], length 416
06:56:03.056353 IP ubuntu-s-1vcpu-1gb-tor1-01.ssh > 162.243.188.66.2328: Flags [P.], seq 82304:82720, ack 1, win 502, options [nop,nop,TS val 1107905047 ecr 4160161368], length 416
06:56:03.056461 IP ubuntu-s-1vcpu-1gb-tor1-01.ssh > 162.243.188.66.2328: Flags [P.], seq 82720:83312, ack 1, win 502, options [nop,nop,TS val 1107905047 ecr 4160161368], length 592
06:56:03.056550 IP ubuntu-s-1vcpu-1gb-tor1-01.ssh > 162.243.188.66.2328: Flags [P.], seq 83312:83872, ack 1, win 502, options [nop,nop,TS val 1107905047 ecr 4160161368], length 560
06:56:03.056615 IP ubuntu-s-1vcpu-1gb-tor1-01.ssh > 162.243.188.66.2328: Flags [P.], seq 83872:84256, ack 1, win 502, options [nop,nop,TS val 1107905047 ecr 4160161368], length 384
06:56:03.056680 IP ubuntu-s-1vcpu-1gb-tor1-01.ssh > 162.243.188.66.2328: Flags [P.], seq 84256:84480, ack 1, win 502, options [nop,nop,TS val 1107905047 ecr 4160161368], length 224
06:56:03.056746 IP ubuntu-s-1vcpu-1gb-tor1-01.ssh > 162.243.188.66.2328: Flags [P.], seq 84480:84704, ack 1, win 502, options [nop,nop,TS val 1107905047 ecr 4160161368], length 224
06:56:03.056811 IP ubuntu-s-1vcpu-1gb-tor1-01.ssh > 162.243.188.66.2328: Flags [P.], seq 84704:84768, ack 1, win 502, options [nop,nop,TS val 1107905047 ecr 4160161368], length 64
06:56:03.056854 IP ubuntu-s-1vcpu-1gb-tor1-01.ssh > 162.243.188.66.2328: Flags [P.], seq 84768:85152, ack 1, win 502, options [nop,nop,TS val 1107905047 ecr 4160161368], length 384
06:56:03.056927 IP ubuntu-s-1vcpu-1gb-tor1-01.ssh > 162.243.188.66.2328: Flags [P.], seq 85152:85376, ack 1, win 502, options [nop,nop,TS val 1107905047 ecr 4160161368], length 224
06:56:03.056961 IP ubuntu-s-1vcpu-1gb-tor1-01.ssh > 162.243.188.66.2328: Flags [P.], seq 85376:85760, ack 1, win 502, options [nop,nop,TS val 1107905047 ecr 4160161368], length 384
06:56:03.057053 IP ubuntu-s-1vcpu-1gb-tor1-01.ssh > 162.243.188.66.2328: Flags [P.], seq 85760:86048, ack 1, win 502, options [nop,nop,TS val 1107905048 ecr 4160161368], length 288
06:56:03.066614 IP 162.243.188.66.2328 > ubuntu-s-1vcpu-1gb-tor1-01.ssh: Flags [.], ack 63856, win 4039, options [nop,nop,TS val 4160161423 ecr 1107905042], length 0
06:56:03.066943 IP 162.243.188.66.2328 > ubuntu-s-1vcpu-1gb-tor1-01.ssh: Flags [.], ack 65376, win 4028, options [nop,nop,TS val 4160161424 ecr 1107905042], length 0
06:56:03.067361 IP 162.243.188.66.2328 > ubuntu-s-1vcpu-1gb-tor1-01.ssh: Flags [.], ack 66896, win 4017, options [nop,nop,TS val 4160161424 ecr 1107905043], length 0
06:56:03.067756 IP 162.243.188.66.2328 > ubuntu-s-1vcpu-1gb-tor1-01.ssh: Flags [.], ack 68416, win 4006, options [nop,nop,TS val 4160161424 ecr 1107905043], length 0
06:56:03.068366 IP 162.243.188.66.2328 > ubuntu-s-1vcpu-1gb-tor1-01.ssh: Flags [.], ack 69936, win 3995, options [nop,nop,TS val 4160161425 ecr 1107905043], length 0
06:56:03.068366 IP 162.243.188.66.2328 > ubuntu-s-1vcpu-1gb-tor1-01.ssh: Flags [.], ack 70592, win 3990, options [nop,nop,TS val 4160161425 ecr 1107905044], length 0
06:56:03.068763 IP 162.243.188.66.2328 > ubuntu-s-1vcpu-1gb-tor1-01.ssh: Flags [.], ack 71792, win 3981, options [nop,nop,TS val 4160161425 ecr 1107905044], length 0
06:56:03.069027 IP 162.243.188.66.2328 > ubuntu-s-1vcpu-1gb-tor1-01.ssh: Flags [.], ack 73968, win 3964, options [nop,nop,TS val 4160161425 ecr 1107905044], length 0
06:56:03.069555 IP 162.243.188.66.2328 > ubuntu-s-1vcpu-1gb-tor1-01.ssh: Flags [.], ack 75472, win 3953, options [nop,nop,TS val 4160161426 ecr 1107905045], length 0
06:56:03.070211 IP 162.243.188.66.2328 > ubuntu-s-1vcpu-1gb-tor1-01.ssh: Flags [.], ack 76928, win 3942, options [nop,nop,TS val 4160161427 ecr 1107905045], length 0
06:56:03.070808 IP 162.243.188.66.2328 > ubuntu-s-1vcpu-1gb-tor1-01.ssh: Flags [.], ack 78448, win 3931, options [nop,nop,TS val 4160161427 ecr 1107905046], length 0
06:56:03.071008 IP 162.243.188.66.2328 > ubuntu-s-1vcpu-1gb-tor1-01.ssh: Flags [.], ack 80496, win 3915, options [nop,nop,TS val 4160161428 ecr 1107905046], length 0
06:56:03.071008 IP 162.243.188.66.2328 > ubuntu-s-1vcpu-1gb-tor1-01.ssh: Flags [.], ack 81888, win 3905, options [nop,nop,TS val 4160161428 ecr 1107905047], length 0
06:56:03.071479 IP 162.243.188.66.2328 > ubuntu-s-1vcpu-1gb-tor1-01.ssh: Flags [.], ack 82720, win 3899, options [nop,nop,TS val 4160161428 ecr 1107905047], length 0
06:56:03.071479 IP 162.243.188.66.2328 > ubuntu-s-1vcpu-1gb-tor1-01.ssh: Flags [.], ack 83872, win 3890, options [nop,nop,TS val 4160161428 ecr 1107905047], length 0
06:56:03.071735 IP 162.243.188.66.2328 > ubuntu-s-1vcpu-1gb-tor1-01.ssh: Flags [.], ack 85152, win 3880, options [nop,nop,TS val 4160161428 ecr 1107905047], length 0
06:56:03.071990 IP 162.243.188.66.2328 > ubuntu-s-1vcpu-1gb-tor1-01.ssh: Flags [.], ack 86048, win 3873, options [nop,nop,TS val 4160161429 ecr 1107905047], length 0
06:56:03.155324 IP ubuntu-s-1vcpu-1gb-tor1-01.ssh > 162.243.188.66.2328: Flags [P.], seq 86048:86288, ack 1, win 502, options [nop,nop,TS val 1107905146 ecr 4160161429], length 240
06:56:03.155434 IP ubuntu-s-1vcpu-1gb-tor1-01.ssh > 162.243.188.66.2328: Flags [P.], seq 86288:86592, ack 1, win 502, options [nop,nop,TS val 1107905146 ecr 4160161429], length 304
06:56:03.155509 IP ubuntu-s-1vcpu-1gb-tor1-01.ssh > 162.243.188.66.2328: Flags [P.], seq 86592:86832, ack 1, win 502, options [nop,nop,TS val 1107905146 ecr 4160161429], length 240
06:56:03.155593 IP ubuntu-s-1vcpu-1gb-tor1-01.ssh > 162.243.188.66.2328: Flags [P.], seq 86832:87248, ack 1, win 502, options [nop,nop,TS val 1107905146 ecr 4160161429], length 416
06:56:03.155699 IP ubuntu-s-1vcpu-1gb-tor1-01.ssh > 162.243.188.66.2328: Flags [P.], seq 87248:87856, ack 1, win 502, options [nop,nop,TS val 1107905146 ecr 4160161429], length 608
06:56:03.155777 IP ubuntu-s-1vcpu-1gb-tor1-01.ssh > 162.243.188.66.2328: Flags [P.], seq 87856:88272, ack 1, win 502, options [nop,nop,TS val 1107905146 ecr 4160161429], length 416
06:56:03.155877 IP ubuntu-s-1vcpu-1gb-tor1-01.ssh > 162.243.188.66.2328: Flags [P.], seq 88272:88880, ack 1, win 502, options [nop,nop,TS val 1107905146 ecr 4160161429], length 608
06:56:03.155971 IP ubuntu-s-1vcpu-1gb-tor1-01.ssh > 162.243.188.66.2328: Flags [P.], seq 88880:89120, ack 1, win 502, options [nop,nop,TS val 1107905146 ecr 4160161429], length 240
06:56:03.156013 IP ubuntu-s-1vcpu-1gb-tor1-01.ssh > 162.243.188.66.2328: Flags [P.], seq 89120:89536, ack 1, win 502, options [nop,nop,TS val 1107905146 ecr 4160161429], length 416
06:56:03.156095 IP ubuntu-s-1vcpu-1gb-tor1-01.ssh > 162.243.188.66.2328: Flags [P.], seq 89536:89776, ack 1, win 502, options [nop,nop,TS val 1107905147 ecr 4160161429], length 240
06:56:03.156166 IP ubuntu-s-1vcpu-1gb-tor1-01.ssh > 162.243.188.66.2328: Flags [P.], seq 89776:90432, ack 1, win 502, options [nop,nop,TS val 1107905147 ecr 4160161429], length 656
06:56:03.156231 IP ubuntu-s-1vcpu-1gb-tor1-01.ssh > 162.243.188.66.2328: Flags [P.], seq 90432:91040, ack 1, win 502, options [nop,nop,TS val 1107905147 ecr 4160161429], length 608
06:56:03.156312 IP ubuntu-s-1vcpu-1gb-tor1-01.ssh > 162.243.188.66.2328: Flags [P.], seq 91040:91456, ack 1, win 502, options [nop,nop,TS val 1107905147 ecr 4160161429], length 416
06:56:03.156420 IP ubuntu-s-1vcpu-1gb-tor1-01.ssh > 162.243.188.66.2328: Flags [P.], seq 91456:92240, ack 1, win 502, options [nop,nop,TS val 1107905147 ecr 4160161429], length 784
06:56:03.156500 IP ubuntu-s-1vcpu-1gb-tor1-01.ssh > 162.243.188.66.2328: Flags [P.], seq 92240:93024, ack 1, win 502, options [nop,nop,TS val 1107905147 ecr 4160161429], length 784
06:56:03.156567 IP ubuntu-s-1vcpu-1gb-tor1-01.ssh > 162.243.188.66.2328: Flags [P.], seq 93024:93632, ack 1, win 502, options [nop,nop,TS val 1107905147 ecr 4160161429], length 608
06:56:03.156646 IP ubuntu-s-1vcpu-1gb-tor1-01.ssh > 162.243.188.66.2328: Flags [P.], seq 93632:94048, ack 1, win 502, options [nop,nop,TS val 1107905147 ecr 4160161429], length 416
06:56:03.156741 IP ubuntu-s-1vcpu-1gb-tor1-01.ssh > 162.243.188.66.2328: Flags [P.], seq 94048:94832, ack 1, win 502, options [nop,nop,TS val 1107905147 ecr 4160161429], length 784
06:56:03.156806 IP ubuntu-s-1vcpu-1gb-tor1-01.ssh > 162.243.188.66.2328: Flags [P.], seq 94832:95440, ack 1, win 502, options [nop,nop,TS val 1107905147 ecr 4160161429], length 608
06:56:03.156870 IP ubuntu-s-1vcpu-1gb-tor1-01.ssh > 162.243.188.66.2328: Flags [P.], seq 95440:96048, ack 1, win 502, options [nop,nop,TS val 1107905147 ecr 4160161429], length 608
06:56:03.156932 IP ubuntu-s-1vcpu-1gb-tor1-01.ssh > 162.243.188.66.2328: Flags [P.], seq 96048:96464, ack 1, win 502, options [nop,nop,TS val 1107905147 ecr 4160161429], length 416
06:56:03.156995 IP ubuntu-s-1vcpu-1gb-tor1-01.ssh > 162.243.188.66.2328: Flags [P.], seq 96464:96704, ack 1, win 502, options [nop,nop,TS val 1107905147 ecr 4160161429], length 240
06:56:03.157060 IP ubuntu-s-1vcpu-1gb-tor1-01.ssh > 162.243.188.66.2328: Flags [P.], seq 96704:96944, ack 1, win 502, options [nop,nop,TS val 1107905148 ecr 4160161429], length 240
06:56:03.157088 IP ubuntu-s-1vcpu-1gb-tor1-01.ssh > 162.243.188.66.2328: Flags [P.], seq 96944:97360, ack 1, win 502, options [nop,nop,TS val 1107905148 ecr 4160161429], length 416
06:56:03.157166 IP ubuntu-s-1vcpu-1gb-tor1-01.ssh > 162.243.188.66.2328: Flags [P.], seq 97360:97776, ack 1, win 502, options [nop,nop,TS val 1107905148 ecr 4160161429], length 416
06:56:03.157218 IP ubuntu-s-1vcpu-1gb-tor1-01.ssh > 162.243.188.66.2328: Flags [P.], seq 97776:98192, ack 1, win 502, options [nop,nop,TS val 1107905148 ecr 4160161429], length 416
06:56:03.157268 IP ubuntu-s-1vcpu-1gb-tor1-01.ssh > 162.243.188.66.2328: Flags [P.], seq 98192:98432, ack 1, win 502, options [nop,nop,TS val 1107905148 ecr 4160161429], length 240
06:56:03.157319 IP ubuntu-s-1vcpu-1gb-tor1-01.ssh > 162.243.188.66.2328: Flags [P.], seq 98432:99040, ack 1, win 502, options [nop,nop,TS val 1107905148 ecr 4160161429], length 608
06:56:03.157376 IP ubuntu-s-1vcpu-1gb-tor1-01.ssh > 162.243.188.66.2328: Flags [P.], seq 99040:99456, ack 1, win 502, options [nop,nop,TS val 1107905148 ecr 4160161429], length 416
06:56:03.157421 IP ubuntu-s-1vcpu-1gb-tor1-01.ssh > 162.243.188.66.2328: Flags [P.], seq 99456:99872, ack 1, win 502, options [nop,nop,TS val 1107905148 ecr 4160161429], length 416
06:56:03.157479 IP ubuntu-s-1vcpu-1gb-tor1-01.ssh > 162.243.188.66.2328: Flags [P.], seq 99872:100528, ack 1, win 502, options [nop,nop,TS val 1107905148 ecr 4160161429], length 656
06:56:03.157539 IP ubuntu-s-1vcpu-1gb-tor1-01.ssh > 162.243.188.66.2328: Flags [P.], seq 100528:101008, ack 1, win 502, options [nop,nop,TS val 1107905148 ecr 4160161429], length 480
06:56:03.157593 IP ubuntu-s-1vcpu-1gb-tor1-01.ssh > 162.243.188.66.2328: Flags [P.], seq 101008:101424, ack 1, win 502, options [nop,nop,TS val 1107905148 ecr 4160161429], length 416
06:56:03.157644 IP ubuntu-s-1vcpu-1gb-tor1-01.ssh > 162.243.188.66.2328: Flags [P.], seq 101424:101664, ack 1, win 502, options [nop,nop,TS val 1107905148 ecr 4160161429], length 240
06:56:03.157696 IP ubuntu-s-1vcpu-1gb-tor1-01.ssh > 162.243.188.66.2328: Flags [P.], seq 101664:101904, ack 1, win 502, options [nop,nop,TS val 1107905148 ecr 4160161429], length 240
06:56:03.157746 IP ubuntu-s-1vcpu-1gb-tor1-01.ssh > 162.243.188.66.2328: Flags [P.], seq 101904:102320, ack 1, win 502, options [nop,nop,TS val 1107905148 ecr 4160161429], length 416
06:56:03.157796 IP ubuntu-s-1vcpu-1gb-tor1-01.ssh > 162.243.188.66.2328: Flags [P.], seq 102320:102720, ack 1, win 502, options [nop,nop,TS val 1107905148 ecr 4160161429], length 400
06:56:03.157847 IP ubuntu-s-1vcpu-1gb-tor1-01.ssh > 162.243.188.66.2328: Flags [P.], seq 102720:103104, ack 1, win 502, options [nop,nop,TS val 1107905148 ecr 4160161429], length 384
06:56:03.157898 IP ubuntu-s-1vcpu-1gb-tor1-01.ssh > 162.243.188.66.2328: Flags [P.], seq 103104:103664, ack 1, win 502, options [nop,nop,TS val 1107905148 ecr 4160161429], length 560
06:56:03.158095 IP ubuntu-s-1vcpu-1gb-tor1-01.ssh > 162.243.188.66.2328: Flags [P.], seq 103664:103888, ack 1, win 502, options [nop,nop,TS val 1107905149 ecr 4160161429], length 224
06:56:03.158251 IP ubuntu-s-1vcpu-1gb-tor1-01.ssh > 162.243.188.66.2328: Flags [P.], seq 103888:105616, ack 1, win 502, options [nop,nop,TS val 1107905149 ecr 4160161429], length 1728
06:56:03.170034 IP 162.243.188.66.2328 > ubuntu-s-1vcpu-1gb-tor1-01.ssh: Flags [.], ack 87248, win 3954, options [nop,nop,TS val 4160161527 ecr 1107905146], length 0
06:56:03.170140 IP 162.243.188.66.2328 > ubuntu-s-1vcpu-1gb-tor1-01.ssh: Flags [.], ack 88272, win 3946, options [nop,nop,TS val 4160161527 ecr 1107905146], length 0
06:56:03.170383 IP 162.243.188.66.2328 > ubuntu-s-1vcpu-1gb-tor1-01.ssh: Flags [.], ack 89120, win 3940, options [nop,nop,TS val 4160161528 ecr 1107905146], length 0
06:56:03.170383 IP 162.243.188.66.2328 > ubuntu-s-1vcpu-1gb-tor1-01.ssh: Flags [.], ack 90432, win 3930, options [nop,nop,TS val 4160161528 ecr 1107905146], length 0
06:56:03.170508 IP 162.243.188.66.2328 > ubuntu-s-1vcpu-1gb-tor1-01.ssh: Flags [.], ack 91456, win 3922, options [nop,nop,TS val 4160161528 ecr 1107905147], length 0
06:56:03.170782 IP 162.243.188.66.2328 > ubuntu-s-1vcpu-1gb-tor1-01.ssh: Flags [.], ack 93024, win 3911, options [nop,nop,TS val 4160161528 ecr 1107905147], length 0
06:56:03.170875 IP 162.243.188.66.2328 > ubuntu-s-1vcpu-1gb-tor1-01.ssh: Flags [.], ack 94048, win 3903, options [nop,nop,TS val 4160161528 ecr 1107905147], length 0
06:56:03.170995 IP 162.243.188.66.2328 > ubuntu-s-1vcpu-1gb-tor1-01.ssh: Flags [.], ack 95440, win 3893, options [nop,nop,TS val 4160161528 ecr 1107905147], length 0
06:56:03.171151 IP 162.243.188.66.2328 > ubuntu-s-1vcpu-1gb-tor1-01.ssh: Flags [.], ack 96464, win 3885, options [nop,nop,TS val 4160161528 ecr 1107905147], length 0
06:56:03.171369 IP 162.243.188.66.2328 > ubuntu-s-1vcpu-1gb-tor1-01.ssh: Flags [.], ack 97360, win 3878, options [nop,nop,TS val 4160161529 ecr 1107905147], length 0
06:56:03.171482 IP 162.243.188.66.2328 > ubuntu-s-1vcpu-1gb-tor1-01.ssh: Flags [.], ack 98192, win 3872, options [nop,nop,TS val 4160161529 ecr 1107905148], length 0
06:56:03.171571 IP 162.243.188.66.2328 > ubuntu-s-1vcpu-1gb-tor1-01.ssh: Flags [.], ack 99040, win 3866, options [nop,nop,TS val 4160161529 ecr 1107905148], length 0
06:56:03.171690 IP 162.243.188.66.2328 > ubuntu-s-1vcpu-1gb-tor1-01.ssh: Flags [.], ack 99872, win 3860, options [nop,nop,TS val 4160161529 ecr 1107905148], length 0
06:56:03.171787 IP 162.243.188.66.2328 > ubuntu-s-1vcpu-1gb-tor1-01.ssh: Flags [.], ack 101008, win 3852, options [nop,nop,TS val 4160161529 ecr 1107905148], length 0
06:56:03.171975 IP 162.243.188.66.2328 > ubuntu-s-1vcpu-1gb-tor1-01.ssh: Flags [.], ack 101904, win 3845, options [nop,nop,TS val 4160161529 ecr 1107905148], length 0
06:56:03.172042 IP 162.243.188.66.2328 > ubuntu-s-1vcpu-1gb-tor1-01.ssh: Flags [.], ack 102720, win 3839, options [nop,nop,TS val 4160161529 ecr 1107905148], length 0
06:56:03.172244 IP 162.243.188.66.2328 > ubuntu-s-1vcpu-1gb-tor1-01.ssh: Flags [.], ack 103664, win 3832, options [nop,nop,TS val 4160161530 ecr 1107905148], length 0
06:56:03.172508 IP 162.243.188.66.2328 > ubuntu-s-1vcpu-1gb-tor1-01.ssh: Flags [.], ack 105616, win 3817, options [nop,nop,TS val 4160161530 ecr 1107905149], length 0
06:56:03.259401 IP ubuntu-s-1vcpu-1gb-tor1-01.ssh > 162.243.188.66.2328: Flags [P.], seq 105616:105856, ack 1, win 502, options [nop,nop,TS val 1107905250 ecr 4160161530], length 240
06:56:03.259516 IP ubuntu-s-1vcpu-1gb-tor1-01.ssh > 162.243.188.66.2328: Flags [P.], seq 105856:106160, ack 1, win 502, options [nop,nop,TS val 1107905250 ecr 4160161530], length 304
06:56:03.259674 IP ubuntu-s-1vcpu-1gb-tor1-01.ssh > 162.243.188.66.2328: Flags [P.], seq 106160:107248, ack 1, win 502, options [nop,nop,TS val 1107905250 ecr 4160161530], length 1088
06:56:03.259774 IP ubuntu-s-1vcpu-1gb-tor1-01.ssh > 162.243.188.66.2328: Flags [P.], seq 107248:108032, ack 1, win 502, options [nop,nop,TS val 1107905250 ecr 4160161530], length 784
06:56:03.259898 IP ubuntu-s-1vcpu-1gb-tor1-01.ssh > 162.243.188.66.2328: Flags [P.], seq 108032:108448, ack 1, win 502, options [nop,nop,TS val 1107905250 ecr 4160161530], length 416
06:56:03.259955 IP ubuntu-s-1vcpu-1gb-tor1-01.ssh > 162.243.188.66.2328: Flags [P.], seq 108448:108928, ack 1, win 502, options [nop,nop,TS val 1107905250 ecr 4160161530], length 480
06:56:03.260049 IP ubuntu-s-1vcpu-1gb-tor1-01.ssh > 162.243.188.66.2328: Flags [P.], seq 108928:109584, ack 1, win 502, options [nop,nop,TS val 1107905251 ecr 4160161530], length 656
06:56:03.260151 IP ubuntu-s-1vcpu-1gb-tor1-01.ssh > 162.243.188.66.2328: Flags [P.], seq 109584:110240, ack 1, win 502, options [nop,nop,TS val 1107905251 ecr 4160161530], length 656
06:56:03.260235 IP ubuntu-s-1vcpu-1gb-tor1-01.ssh > 162.243.188.66.2328: Flags [P.], seq 110240:110656, ack 1, win 502, options [nop,nop,TS val 1107905251 ecr 4160161530], length 416
06:56:03.260311 IP ubuntu-s-1vcpu-1gb-tor1-01.ssh > 162.243.188.66.2328: Flags [P.], seq 110656:111680, ack 1, win 502, options [nop,nop,TS val 1107905251 ecr 4160161530], length 1024
06:56:03.260387 IP ubuntu-s-1vcpu-1gb-tor1-01.ssh > 162.243.188.66.2328: Flags [P.], seq 111680:112288, ack 1, win 502, options [nop,nop,TS val 1107905251 ecr 4160161530], length 608
06:56:03.260454 IP ubuntu-s-1vcpu-1gb-tor1-01.ssh > 162.243.188.66.2328: Flags [P.], seq 112288:112768, ack 1, win 502, options [nop,nop,TS val 1107905251 ecr 4160161530], length 480
06:56:03.260529 IP ubuntu-s-1vcpu-1gb-tor1-01.ssh > 162.243.188.66.2328: Flags [P.], seq 112768:113440, ack 1, win 502, options [nop,nop,TS val 1107905251 ecr 4160161530], length 672
06:56:03.260769 IP ubuntu-s-1vcpu-1gb-tor1-01.ssh > 162.243.188.66.2328: Flags [P.], seq 113440:115712, ack 1, win 502, options [nop,nop,TS val 1107905251 ecr 4160161530], length 2272
06:56:03.260841 IP ubuntu-s-1vcpu-1gb-tor1-01.ssh > 162.243.188.66.2328: Flags [P.], seq 115712:116096, ack 1, win 502, options [nop,nop,TS val 1107905251 ecr 4160161530], length 384
06:56:03.260905 IP ubuntu-s-1vcpu-1gb-tor1-01.ssh > 162.243.188.66.2328: Flags [P.], seq 116096:116704, ack 1, win 502, options [nop,nop,TS val 1107905251 ecr 4160161530], length 608
06:56:03.260976 IP ubuntu-s-1vcpu-1gb-tor1-01.ssh > 162.243.188.66.2328: Flags [P.], seq 116704:117152, ack 1, win 502, options [nop,nop,TS val 1107905251 ecr 4160161530], length 448
06:56:03.261047 IP ubuntu-s-1vcpu-1gb-tor1-01.ssh > 162.243.188.66.2328: Flags [P.], seq 117152:117600, ack 1, win 502, options [nop,nop,TS val 1107905252 ecr 4160161530], length 448
06:56:03.261108 IP ubuntu-s-1vcpu-1gb-tor1-01.ssh > 162.243.188.66.2328: Flags [P.], seq 117600:117824, ack 1, win 502, options [nop,nop,TS val 1107905252 ecr 4160161530], length 224
06:56:03.261178 IP ubuntu-s-1vcpu-1gb-tor1-01.ssh > 162.243.188.66.2328: Flags [P.], seq 117824:118048, ack 1, win 502, options [nop,nop,TS val 1107905252 ecr 4160161530], length 224
06:56:03.261247 IP ubuntu-s-1vcpu-1gb-tor1-01.ssh > 162.243.188.66.2328: Flags [P.], seq 118048:118336, ack 1, win 502, options [nop,nop,TS val 1107905252 ecr 4160161530], length 288
06:56:03.274127 IP 162.243.188.66.2328 > ubuntu-s-1vcpu-1gb-tor1-01.ssh: Flags [.], ack 107248, win 3958, options [nop,nop,TS val 4160161631 ecr 1107905250], length 0
06:56:03.274332 IP 162.243.188.66.2328 > ubuntu-s-1vcpu-1gb-tor1-01.ssh: Flags [.], ack 108928, win 3946, options [nop,nop,TS val 4160161632 ecr 1107905250], length 0
06:56:03.274406 IP 162.243.188.66.2328 > ubuntu-s-1vcpu-1gb-tor1-01.ssh: Flags [.], ack 110240, win 3937, options [nop,nop,TS val 4160161632 ecr 1107905251], length 0
06:56:03.274589 IP 162.243.188.66.2328 > ubuntu-s-1vcpu-1gb-tor1-01.ssh: Flags [.], ack 111680, win 3927, options [nop,nop,TS val 4160161632 ecr 1107905251], length 0
06:56:03.275086 IP 162.243.188.66.2328 > ubuntu-s-1vcpu-1gb-tor1-01.ssh: Flags [.], ack 113440, win 3914, options [nop,nop,TS val 4160161632 ecr 1107905251], length 0
06:56:03.275171 IP 162.243.188.66.2328 > ubuntu-s-1vcpu-1gb-tor1-01.ssh: Flags [.], ack 115712, win 3901, options [nop,nop,TS val 4160161632 ecr 1107905251], length 0
06:56:03.275423 IP 162.243.188.66.2328 > ubuntu-s-1vcpu-1gb-tor1-01.ssh: Flags [.], ack 117600, win 3887, options [nop,nop,TS val 4160161633 ecr 1107905251], length 0
06:56:03.319100 IP ubuntu-s-1vcpu-1gb-tor1-01.ssh > 162.243.188.66.2328: Flags [P.], seq 118048:118336, ack 1, win 502, options [nop,nop,TS val 1107905310 ecr 4160161633], length 288
06:56:03.323023 IP 162.243.188.66.2328 > ubuntu-s-1vcpu-1gb-tor1-01.ssh: Flags [.], ack 118336, win 3940, options [nop,nop,TS val 4160161680 ecr 1107905252], length 0
06:56:03.333512 IP 162.243.188.66.2328 > ubuntu-s-1vcpu-1gb-tor1-01.ssh: Flags [.], ack 118336, win 3940, options [nop,nop,TS val 4160161691 ecr 1107905310,nop,nop,sack 1 {118048:118336}], length 0
06:56:03.355719 IP 198-74-50-114.ip.linodeusercontent.com.40856 > ubuntu-s-1vcpu-1gb-tor1-01.81: Flags [S], seq 2544064952, win 65535, options [mss 1460], length 0
06:56:03.355753 IP ubuntu-s-1vcpu-1gb-tor1-01.81 > 198-74-50-114.ip.linodeusercontent.com.40856: Flags [R.], seq 0, ack 2544064953, win 0, length 0
06:56:03.363288 IP ubuntu-s-1vcpu-1gb-tor1-01.ssh > 162.243.188.66.2328: Flags [P.], seq 118336:118576, ack 1, win 502, options [nop,nop,TS val 1107905354 ecr 4160161691], length 240
06:56:03.363420 IP ubuntu-s-1vcpu-1gb-tor1-01.ssh > 162.243.188.66.2328: Flags [P.], seq 118576:119056, ack 1, win 502, options [nop,nop,TS val 1107905354 ecr 4160161691], length 480
06:56:03.363516 IP ubuntu-s-1vcpu-1gb-tor1-01.ssh > 162.243.188.66.2328: Flags [P.], seq 119056:119296, ack 1, win 502, options [nop,nop,TS val 1107905354 ecr 4160161691], length 240
06:56:03.363528 IP ubuntu-s-1vcpu-1gb-tor1-01.ssh > 162.243.188.66.2328: Flags [P.], seq 119296:119728, ack 1, win 502, options [nop,nop,TS val 1107905354 ecr 4160161691], length 432
06:56:03.363591 IP ubuntu-s-1vcpu-1gb-tor1-01.ssh > 162.243.188.66.2328: Flags [P.], seq 119728:120336, ack 1, win 502, options [nop,nop,TS val 1107905354 ecr 4160161691], length 608
06:56:03.363713 IP ubuntu-s-1vcpu-1gb-tor1-01.ssh > 162.243.188.66.2328: Flags [P.], seq 120336:120768, ack 1, win 502, options [nop,nop,TS val 1107905354 ecr 4160161691], length 432
06:56:03.363756 IP ubuntu-s-1vcpu-1gb-tor1-01.ssh > 162.243.188.66.2328: Flags [P.], seq 120768:121376, ack 1, win 502, options [nop,nop,TS val 1107905354 ecr 4160161691], length 608
06:56:03.363849 IP ubuntu-s-1vcpu-1gb-tor1-01.ssh > 162.243.188.66.2328: Flags [P.], seq 121376:122048, ack 1, win 502, options [nop,nop,TS val 1107905354 ecr 4160161691], length 672
06:56:03.363930 IP ubuntu-s-1vcpu-1gb-tor1-01.ssh > 162.243.188.66.2328: Flags [P.], seq 122048:122656, ack 1, win 502, options [nop,nop,TS val 1107905354 ecr 4160161691], length 608
06:56:03.364025 IP ubuntu-s-1vcpu-1gb-tor1-01.ssh > 162.243.188.66.2328: Flags [P.], seq 122656:123184, ack 1, win 502, options [nop,nop,TS val 1107905354 ecr 4160161691], length 528
06:56:03.364110 IP ubuntu-s-1vcpu-1gb-tor1-01.ssh > 162.243.188.66.2328: Flags [P.], seq 123184:123648, ack 1, win 502, options [nop,nop,TS val 1107905355 ecr 4160161691], length 464
06:56:03.364197 IP ubuntu-s-1vcpu-1gb-tor1-01.ssh > 162.243.188.66.2328: Flags [P.], seq 123648:124032, ack 1, win 502, options [nop,nop,TS val 1107905355 ecr 4160161691], length 384
06:56:03.364280 IP ubuntu-s-1vcpu-1gb-tor1-01.ssh > 162.243.188.66.2328: Flags [P.], seq 124032:124672, ack 1, win 502, options [nop,nop,TS val 1107905355 ecr 4160161691], length 640
06:56:03.364678 IP ubuntu-s-1vcpu-1gb-tor1-01.45119 > 67.207.67.2.domain: 61966+ [1au] PTR? 114.50.74.198.in-addr.arpa. (55)
06:56:03.364744 IP ubuntu-s-1vcpu-1gb-tor1-01.33696 > 67.207.67.2.domain: 57074+ [1au] PTR? 114.50.74.198.in-addr.arpa. (55)
06:56:03.364791 IP ubuntu-s-1vcpu-1gb-tor1-01.42168 > 67.207.67.2.domain: Flags [P.], seq 92:138, ack 226, win 502, options [nop,nop,TS val 979442607 ecr 2080123638], length 46 58952+ PTR? 114.50.74.198.in-addr.arpa. (44)
06:56:03.364848 IP ubuntu-s-1vcpu-1gb-tor1-01.ssh > 162.243.188.66.2328: Flags [P.], seq 124672:125104, ack 1, win 502, options [nop,nop,TS val 1107905355 ecr 4160161691], length 432
06:56:03.365335 IP 67.207.67.2.domain > ubuntu-s-1vcpu-1gb-tor1-01.42168: Flags [P.], seq 226:324, ack 138, win 128, options [nop,nop,TS val 2080124367 ecr 979442607], length 98 58952 1/0/0 PTR 198-74-50-114.ip.linodeusercontent.com. (96)
06:56:03.365356 IP ubuntu-s-1vcpu-1gb-tor1-01.42168 > 67.207.67.2.domain: Flags [.], ack 324, win 502, options [nop,nop,TS val 979442608 ecr 2080124367], length 0
06:56:03.365527 IP 67.207.67.2.domain > ubuntu-s-1vcpu-1gb-tor1-01.45119: 61966 1/0/1 PTR 198-74-50-114.ip.linodeusercontent.com. (107)
06:56:03.365715 IP ubuntu-s-1vcpu-1gb-tor1-01.ssh > 162.243.188.66.2328: Flags [P.], seq 125104:125328, ack 1, win 502, options [nop,nop,TS val 1107905356 ecr 4160161691], length 224
06:56:03.365849 IP ubuntu-s-1vcpu-1gb-tor1-01.ssh > 162.243.188.66.2328: Flags [P.], seq 125328:125392, ack 1, win 502, options [nop,nop,TS val 1107905356 ecr 4160161691], length 64
06:56:03.365866 IP ubuntu-s-1vcpu-1gb-tor1-01.ssh > 162.243.188.66.2328: Flags [P.], seq 125392:125600, ack 1, win 502, options [nop,nop,TS val 1107905356 ecr 4160161691], length 208
06:56:03.366079 IP ubuntu-s-1vcpu-1gb-tor1-01.ssh > 162.243.188.66.2328: Flags [P.], seq 125600:125664, ack 1, win 502, options [nop,nop,TS val 1107905357 ecr 4160161691], length 64
06:56:03.377737 IP 162.243.188.66.2328 > ubuntu-s-1vcpu-1gb-tor1-01.ssh: Flags [.], ack 118576, win 4004, options [nop,nop,TS val 4160161735 ecr 1107905354], length 0
06:56:03.377778 IP 162.243.188.66.2328 > ubuntu-s-1vcpu-1gb-tor1-01.ssh: Flags [.], ack 119056, win 4001, options [nop,nop,TS val 4160161735 ecr 1107905354], length 0
06:56:03.377778 IP 162.243.188.66.2328 > ubuntu-s-1vcpu-1gb-tor1-01.ssh: Flags [.], ack 119296, win 4000, options [nop,nop,TS val 4160161735 ecr 1107905354], length 0
06:56:03.377853 IP 162.243.188.66.2328 > ubuntu-s-1vcpu-1gb-tor1-01.ssh: Flags [.], ack 119728, win 3997, options [nop,nop,TS val 4160161735 ecr 1107905354], length 0
06:56:03.377853 IP 162.243.188.66.2328 > ubuntu-s-1vcpu-1gb-tor1-01.ssh: Flags [.], ack 120336, win 3993, options [nop,nop,TS val 4160161735 ecr 1107905354], length 0
06:56:03.378039 IP 162.243.188.66.2328 > ubuntu-s-1vcpu-1gb-tor1-01.ssh: Flags [.], ack 120768, win 3990, options [nop,nop,TS val 4160161735 ecr 1107905354], length 0
06:56:03.378282 IP 162.243.188.66.2328 > ubuntu-s-1vcpu-1gb-tor1-01.ssh: Flags [.], ack 121376, win 3986, options [nop,nop,TS val 4160161735 ecr 1107905354], length 0
06:56:03.378282 IP 162.243.188.66.2328 > ubuntu-s-1vcpu-1gb-tor1-01.ssh: Flags [.], ack 122048, win 3981, options [nop,nop,TS val 4160161735 ecr 1107905354], length 0
06:56:03.378360 IP 162.243.188.66.2328 > ubuntu-s-1vcpu-1gb-tor1-01.ssh: Flags [.], ack 122656, win 3977, options [nop,nop,TS val 4160161735 ecr 1107905354], length 0
06:56:03.378450 IP 162.243.188.66.2328 > ubuntu-s-1vcpu-1gb-tor1-01.ssh: Flags [.], ack 123184, win 3973, options [nop,nop,TS val 4160161736 ecr 1107905354], length 0
06:56:03.378450 IP 162.243.188.66.2328 > ubuntu-s-1vcpu-1gb-tor1-01.ssh: Flags [.], ack 123648, win 3970, options [nop,nop,TS val 4160161736 ecr 1107905355], length 0
06:56:03.378450 IP 162.243.188.66.2328 > ubuntu-s-1vcpu-1gb-tor1-01.ssh: Flags [.], ack 124032, win 3967, options [nop,nop,TS val 4160161736 ecr 1107905355], length 0
06:56:03.378586 IP 162.243.188.66.2328 > ubuntu-s-1vcpu-1gb-tor1-01.ssh: Flags [.], ack 124672, win 3962, options [nop,nop,TS val 4160161736 ecr 1107905355], length 0
06:56:03.379264 IP 162.243.188.66.2328 > ubuntu-s-1vcpu-1gb-tor1-01.ssh: Flags [.], ack 125104, win 3959, options [nop,nop,TS val 4160161736 ecr 1107905355], length 0
06:56:03.380097 IP 162.243.188.66.2328 > ubuntu-s-1vcpu-1gb-tor1-01.ssh: Flags [.], ack 125328, win 3958, options [nop,nop,TS val 4160161737 ecr 1107905356], length 0
06:56:03.423108 IP ubuntu-s-1vcpu-1gb-tor1-01.ssh > 162.243.188.66.2328: Flags [P.], seq 125600:125664, ack 1, win 502, options [nop,nop,TS val 1107905414 ecr 4160161737], length 64
06:56:03.423283 IP 162.243.188.66.2328 > ubuntu-s-1vcpu-1gb-tor1-01.ssh: Flags [.], ack 125664, win 4009, options [nop,nop,TS val 4160161780 ecr 1107905356], length 0
06:56:03.437484 IP 162.243.188.66.2328 > ubuntu-s-1vcpu-1gb-tor1-01.ssh: Flags [.], ack 125664, win 4009, options [nop,nop,TS val 4160161795 ecr 1107905414,nop,nop,sack 1 {125600:125664}], length 0
06:56:03.467332 IP ubuntu-s-1vcpu-1gb-tor1-01.ssh > 162.243.188.66.2328: Flags [P.], seq 125664:125904, ack 1, win 502, options [nop,nop,TS val 1107905458 ecr 4160161795], length 240
06:56:03.467488 IP ubuntu-s-1vcpu-1gb-tor1-01.ssh > 162.243.188.66.2328: Flags [P.], seq 125904:126208, ack 1, win 502, options [nop,nop,TS val 1107905458 ecr 4160161795], length 304
06:56:03.467631 IP ubuntu-s-1vcpu-1gb-tor1-01.ssh > 162.243.188.66.2328: Flags [P.], seq 126208:126576, ack 1, win 502, options [nop,nop,TS val 1107905458 ecr 4160161795], length 368
06:56:03.467699 IP ubuntu-s-1vcpu-1gb-tor1-01.ssh > 162.243.188.66.2328: Flags [P.], seq 126576:126816, ack 1, win 502, options [nop,nop,TS val 1107905458 ecr 4160161795], length 240
06:56:03.467775 IP ubuntu-s-1vcpu-1gb-tor1-01.ssh > 162.243.188.66.2328: Flags [P.], seq 126816:126880, ack 1, win 502, options [nop,nop,TS val 1107905458 ecr 4160161795], length 64
06:56:03.467825 IP ubuntu-s-1vcpu-1gb-tor1-01.ssh > 162.243.188.66.2328: Flags [P.], seq 126880:127120, ack 1, win 502, options [nop,nop,TS val 1107905458 ecr 4160161795], length 240
06:56:03.467904 IP ubuntu-s-1vcpu-1gb-tor1-01.ssh > 162.243.188.66.2328: Flags [P.], seq 127120:127184, ack 1, win 502, options [nop,nop,TS val 1107905458 ecr 4160161795], length 64
06:56:03.467956 IP ubuntu-s-1vcpu-1gb-tor1-01.ssh > 162.243.188.66.2328: Flags [P.], seq 127184:127488, ack 1, win 502, options [nop,nop,TS val 1107905458 ecr 4160161795], length 304
06:56:03.468067 IP ubuntu-s-1vcpu-1gb-tor1-01.ssh > 162.243.188.66.2328: Flags [P.], seq 127488:127792, ack 1, win 502, options [nop,nop,TS val 1107905459 ecr 4160161795], length 304
06:56:03.468147 IP ubuntu-s-1vcpu-1gb-tor1-01.ssh > 162.243.188.66.2328: Flags [P.], seq 127792:128096, ack 1, win 502, options [nop,nop,TS val 1107905459 ecr 4160161795], length 304
06:56:03.468262 IP ubuntu-s-1vcpu-1gb-tor1-01.ssh > 162.243.188.66.2328: Flags [P.], seq 128096:128640, ack 1, win 502, options [nop,nop,TS val 1107905459 ecr 4160161795], length 544
06:56:03.468326 IP ubuntu-s-1vcpu-1gb-tor1-01.ssh > 162.243.188.66.2328: Flags [P.], seq 128640:128704, ack 1, win 502, options [nop,nop,TS val 1107905459 ecr 4160161795], length 64
06:56:03.468356 IP ubuntu-s-1vcpu-1gb-tor1-01.ssh > 162.243.188.66.2328: Flags [P.], seq 128704:128944, ack 1, win 502, options [nop,nop,TS val 1107905459 ecr 4160161795], length 240
06:56:03.468428 IP ubuntu-s-1vcpu-1gb-tor1-01.ssh > 162.243.188.66.2328: Flags [P.], seq 128944:129376, ack 1, win 502, options [nop,nop,TS val 1107905459 ecr 4160161795], length 432
06:56:03.468496 IP ubuntu-s-1vcpu-1gb-tor1-01.ssh > 162.243.188.66.2328: Flags [P.], seq 129376:129552, ack 1, win 502, options [nop,nop,TS val 1107905459 ecr 4160161795], length 176
06:56:03.468561 IP ubuntu-s-1vcpu-1gb-tor1-01.ssh > 162.243.188.66.2328: Flags [P.], seq 129552:129728, ack 1, win 502, options [nop,nop,TS val 1107905459 ecr 4160161795], length 176
06:56:03.468612 IP ubuntu-s-1vcpu-1gb-tor1-01.ssh > 162.243.188.66.2328: Flags [P.], seq 129728:130016, ack 1, win 502, options [nop,nop,TS val 1107905459 ecr 4160161795], length 288
06:56:03.468685 IP ubuntu-s-1vcpu-1gb-tor1-01.ssh > 162.243.188.66.2328: Flags [P.], seq 130016:130256, ack 1, win 502, options [nop,nop,TS val 1107905459 ecr 4160161795], length 240
06:56:03.468738 IP ubuntu-s-1vcpu-1gb-tor1-01.ssh > 162.243.188.66.2328: Flags [P.], seq 130256:130560, ack 1, win 502, options [nop,nop,TS val 1107905459 ecr 4160161795], length 304
06:56:03.468809 IP ubuntu-s-1vcpu-1gb-tor1-01.ssh > 162.243.188.66.2328: Flags [P.], seq 130560:130624, ack 1, win 502, options [nop,nop,TS val 1107905459 ecr 4160161795], length 64
06:56:03.468842 IP ubuntu-s-1vcpu-1gb-tor1-01.ssh > 162.243.188.66.2328: Flags [P.], seq 130624:130848, ack 1, win 502, options [nop,nop,TS val 1107905459 ecr 4160161795], length 224
06:56:03.468925 IP ubuntu-s-1vcpu-1gb-tor1-01.ssh > 162.243.188.66.2328: Flags [P.], seq 130848:131040, ack 1, win 502, options [nop,nop,TS val 1107905459 ecr 4160161795], length 192
06:56:03.468968 IP ubuntu-s-1vcpu-1gb-tor1-01.ssh > 162.243.188.66.2328: Flags [P.], seq 131040:131280, ack 1, win 502, options [nop,nop,TS val 1107905459 ecr 4160161795], length 240
06:56:03.469042 IP ubuntu-s-1vcpu-1gb-tor1-01.ssh > 162.243.188.66.2328: Flags [P.], seq 131280:131520, ack 1, win 502, options [nop,nop,TS val 1107905460 ecr 4160161795], length 240
06:56:03.469299 IP ubuntu-s-1vcpu-1gb-tor1-01.ssh > 162.243.188.66.2328: Flags [P.], seq 131520:131760, ack 1, win 502, options [nop,nop,TS val 1107905460 ecr 4160161795], length 240
06:56:03.469738 IP ubuntu-s-1vcpu-1gb-tor1-01.ssh > 162.243.188.66.2328: Flags [P.], seq 131760:134352, ack 1, win 502, options [nop,nop,TS val 1107905460 ecr 4160161795], length 2592
06:56:03.470026 IP ubuntu-s-1vcpu-1gb-tor1-01.ssh > 162.243.188.66.2328: Flags [P.], seq 134352:135136, ack 1, win 502, options [nop,nop,TS val 1107905460 ecr 4160161795], length 784
06:56:03.481763 IP 162.243.188.66.2328 > ubuntu-s-1vcpu-1gb-tor1-01.ssh: Flags [.], ack 125904, win 4080, options [nop,nop,TS val 4160161839 ecr 1107905458], length 0
06:56:03.481801 IP 162.243.188.66.2328 > ubuntu-s-1vcpu-1gb-tor1-01.ssh: Flags [.], ack 126208, win 4078, options [nop,nop,TS val 4160161839 ecr 1107905458], length 0
06:56:03.482064 IP 162.243.188.66.2328 > ubuntu-s-1vcpu-1gb-tor1-01.ssh: Flags [.], ack 126576, win 4076, options [nop,nop,TS val 4160161839 ecr 1107905458], length 0
06:56:03.482228 IP 162.243.188.66.2328 > ubuntu-s-1vcpu-1gb-tor1-01.ssh: Flags [.], ack 126816, win 4075, options [nop,nop,TS val 4160161839 ecr 1107905458], length 0
06:56:03.482321 IP 162.243.188.66.2328 > ubuntu-s-1vcpu-1gb-tor1-01.ssh: Flags [.], ack 126880, win 4075, options [nop,nop,TS val 4160161839 ecr 1107905458], length 0
06:56:03.482322 IP 162.243.188.66.2328 > ubuntu-s-1vcpu-1gb-tor1-01.ssh: Flags [.], ack 127120, win 4074, options [nop,nop,TS val 4160161839 ecr 1107905458], length 0
06:56:03.482322 IP 162.243.188.66.2328 > ubuntu-s-1vcpu-1gb-tor1-01.ssh: Flags [.], ack 127184, win 4074, options [nop,nop,TS val 4160161839 ecr 1107905458], length 0
06:56:03.482322 IP 162.243.188.66.2328 > ubuntu-s-1vcpu-1gb-tor1-01.ssh: Flags [.], ack 127488, win 4072, options [nop,nop,TS val 4160161840 ecr 1107905458], length 0
06:56:03.482322 IP 162.243.188.66.2328 > ubuntu-s-1vcpu-1gb-tor1-01.ssh: Flags [.], ack 127792, win 4070, options [nop,nop,TS val 4160161840 ecr 1107905459], length 0
06:56:03.482560 IP 162.243.188.66.2328 > ubuntu-s-1vcpu-1gb-tor1-01.ssh: Flags [.], ack 128096, win 4068, options [nop,nop,TS val 4160161840 ecr 1107905459], length 0
06:56:03.482779 IP 162.243.188.66.2328 > ubuntu-s-1vcpu-1gb-tor1-01.ssh: Flags [.], ack 128640, win 4064, options [nop,nop,TS val 4160161840 ecr 1107905459], length 0
06:56:03.482779 IP 162.243.188.66.2328 > ubuntu-s-1vcpu-1gb-tor1-01.ssh: Flags [.], ack 128704, win 4064, options [nop,nop,TS val 4160161840 ecr 1107905459], length 0
06:56:03.482779 IP 162.243.188.66.2328 > ubuntu-s-1vcpu-1gb-tor1-01.ssh: Flags [.], ack 129376, win 4059, options [nop,nop,TS val 4160161840 ecr 1107905459], length 0
06:56:03.482779 IP 162.243.188.66.2328 > ubuntu-s-1vcpu-1gb-tor1-01.ssh: Flags [.], ack 129552, win 4058, options [nop,nop,TS val 4160161840 ecr 1107905459], length 0
06:56:03.482808 IP 162.243.188.66.2328 > ubuntu-s-1vcpu-1gb-tor1-01.ssh: Flags [.], ack 129728, win 4057, options [nop,nop,TS val 4160161840 ecr 1107905459], length 0
06:56:03.483277 IP 162.243.188.66.2328 > ubuntu-s-1vcpu-1gb-tor1-01.ssh: Flags [.], ack 131280, win 4045, options [nop,nop,TS val 4160161840 ecr 1107905459], length 0
06:56:03.484158 IP 162.243.188.66.2328 > ubuntu-s-1vcpu-1gb-tor1-01.ssh: Flags [.], ack 134352, win 4021, options [nop,nop,TS val 4160161841 ecr 1107905460], length 0
06:56:03.519914 IP 67.207.67.2.domain > ubuntu-s-1vcpu-1gb-tor1-01.33696: 57074 1/0/1 PTR 198-74-50-114.ip.linodeusercontent.com. (107)
06:56:03.531001 IP 162.243.188.66.2328 > ubuntu-s-1vcpu-1gb-tor1-01.ssh: Flags [.], ack 135136, win 4122, options [nop,nop,TS val 4160161888 ecr 1107905460], length 0
06:56:03.571464 IP ubuntu-s-1vcpu-1gb-tor1-01.ssh > 162.243.188.66.2328: Flags [P.], seq 135136:137392, ack 1, win 502, options [nop,nop,TS val 1107905562 ecr 4160161888], length 2256
06:56:03.571673 IP ubuntu-s-1vcpu-1gb-tor1-01.ssh > 162.243.188.66.2328: Flags [P.], seq 137392:139664, ack 1, win 502, options [nop,nop,TS val 1107905562 ecr 4160161888], length 2272
06:56:03.571787 IP ubuntu-s-1vcpu-1gb-tor1-01.ssh > 162.243.188.66.2328: Flags [P.], seq 139664:140448, ack 1, win 502, options [nop,nop,TS val 1107905562 ecr 4160161888], length 784
06:56:03.571853 IP ubuntu-s-1vcpu-1gb-tor1-01.ssh > 162.243.188.66.2328: Flags [P.], seq 140448:140848, ack 1, win 502, options [nop,nop,TS val 1107905562 ecr 4160161888], length 400
06:56:03.571885 IP ubuntu-s-1vcpu-1gb-tor1-01.ssh > 162.243.188.66.2328: Flags [P.], seq 140848:141568, ack 1, win 502, options [nop,nop,TS val 1107905562 ecr 4160161888], length 720
06:56:03.571930 IP ubuntu-s-1vcpu-1gb-tor1-01.ssh > 162.243.188.66.2328: Flags [P.], seq 141568:141792, ack 1, win 502, options [nop,nop,TS val 1107905562 ecr 4160161888], length 224
06:56:03.572003 IP ubuntu-s-1vcpu-1gb-tor1-01.ssh > 162.243.188.66.2328: Flags [P.], seq 141792:142240, ack 1, win 502, options [nop,nop,TS val 1107905562 ecr 4160161888], length 448
06:56:03.572057 IP ubuntu-s-1vcpu-1gb-tor1-01.ssh > 162.243.188.66.2328: Flags [P.], seq 142240:142464, ack 1, win 502, options [nop,nop,TS val 1107905563 ecr 4160161888], length 224
06:56:03.572117 IP ubuntu-s-1vcpu-1gb-tor1-01.ssh > 162.243.188.66.2328: Flags [P.], seq 142464:142864, ack 1, win 502, options [nop,nop,TS val 1107905563 ecr 4160161888], length 400
06:56:03.572218 IP ubuntu-s-1vcpu-1gb-tor1-01.ssh > 162.243.188.66.2328: Flags [P.], seq 142864:143088, ack 1, win 502, options [nop,nop,TS val 1107905563 ecr 4160161888], length 224
06:56:03.572319 IP ubuntu-s-1vcpu-1gb-tor1-01.ssh > 162.243.188.66.2328: Flags [P.], seq 143088:143792, ack 1, win 502, options [nop,nop,TS val 1107905563 ecr 4160161888], length 704
06:56:03.572420 IP ubuntu-s-1vcpu-1gb-tor1-01.ssh > 162.243.188.66.2328: Flags [P.], seq 143792:144016, ack 1, win 502, options [nop,nop,TS val 1107905563 ecr 4160161888], length 224
06:56:03.585884 IP 162.243.188.66.2328 > ubuntu-s-1vcpu-1gb-tor1-01.ssh: Flags [.], ack 137392, win 4183, options [nop,nop,TS val 4160161943 ecr 1107905562], length 0
06:56:03.586035 IP 162.243.188.66.2328 > ubuntu-s-1vcpu-1gb-tor1-01.ssh: Flags [.], ack 139664, win 4171, options [nop,nop,TS val 4160161943 ecr 1107905562], length 0
06:56:03.586199 IP 162.243.188.66.2328 > ubuntu-s-1vcpu-1gb-tor1-01.ssh: Flags [.], ack 141568, win 4157, options [nop,nop,TS val 4160161943 ecr 1107905562], length 0
06:56:03.586532 IP 162.243.188.66.2328 > ubuntu-s-1vcpu-1gb-tor1-01.ssh: Flags [.], ack 143088, win 4146, options [nop,nop,TS val 4160161944 ecr 1107905562], length 0
06:56:03.630601 IP 162.243.188.66.2328 > ubuntu-s-1vcpu-1gb-tor1-01.ssh: Flags [.], ack 144016, win 4193, options [nop,nop,TS val 4160161988 ecr 1107905563], length 0
06:56:03.675297 IP ubuntu-s-1vcpu-1gb-tor1-01.ssh > 162.243.188.66.2328: Flags [P.], seq 144016:144256, ack 1, win 502, options [nop,nop,TS val 1107905666 ecr 4160161988], length 240
06:56:03.675396 IP ubuntu-s-1vcpu-1gb-tor1-01.ssh > 162.243.188.66.2328: Flags [P.], seq 144256:144736, ack 1, win 502, options [nop,nop,TS val 1107905666 ecr 4160161988], length 480
06:56:03.675490 IP ubuntu-s-1vcpu-1gb-tor1-01.ssh > 162.243.188.66.2328: Flags [P.], seq 144736:145408, ack 1, win 502, options [nop,nop,TS val 1107905666 ecr 4160161988], length 672
06:56:03.675578 IP ubuntu-s-1vcpu-1gb-tor1-01.ssh > 162.243.188.66.2328: Flags [P.], seq 145408:146064, ack 1, win 502, options [nop,nop,TS val 1107905666 ecr 4160161988], length 656
06:56:03.675651 IP ubuntu-s-1vcpu-1gb-tor1-01.ssh > 162.243.188.66.2328: Flags [P.], seq 146064:146736, ack 1, win 502, options [nop,nop,TS val 1107905666 ecr 4160161988], length 672
06:56:03.675755 IP ubuntu-s-1vcpu-1gb-tor1-01.ssh > 162.243.188.66.2328: Flags [P.], seq 146736:147360, ack 1, win 502, options [nop,nop,TS val 1107905666 ecr 4160161988], length 624
06:56:03.675854 IP ubuntu-s-1vcpu-1gb-tor1-01.ssh > 162.243.188.66.2328: Flags [P.], seq 147360:147808, ack 1, win 502, options [nop,nop,TS val 1107905666 ecr 4160161988], length 448
06:56:03.692751 IP 162.243.188.66.2328 > ubuntu-s-1vcpu-1gb-tor1-01.ssh: Flags [.], ack 146064, win 4180, options [nop,nop,TS val 4160162047 ecr 1107905666], length 0
06:56:03.692752 IP 162.243.188.66.2328 > ubuntu-s-1vcpu-1gb-tor1-01.ssh: Flags [.], ack 147808, win 4168, options [nop,nop,TS val 4160162047 ecr 1107905666], length 0
06:56:03.779312 IP ubuntu-s-1vcpu-1gb-tor1-01.ssh > 162.243.188.66.2328: Flags [P.], seq 147808:148048, ack 1, win 502, options [nop,nop,TS val 1107905770 ecr 4160162047], length 240
06:56:03.779407 IP ubuntu-s-1vcpu-1gb-tor1-01.ssh > 162.243.188.66.2328: Flags [P.], seq 148048:148352, ack 1, win 502, options [nop,nop,TS val 1107905770 ecr 4160162047], length 304
06:56:03.779467 IP ubuntu-s-1vcpu-1gb-tor1-01.ssh > 162.243.188.66.2328: Flags [P.], seq 148352:148592, ack 1, win 502, options [nop,nop,TS val 1107905770 ecr 4160162047], length 240
06:56:03.779520 IP ubuntu-s-1vcpu-1gb-tor1-01.ssh > 162.243.188.66.2328: Flags [P.], seq 148592:148896, ack 1, win 502, options [nop,nop,TS val 1107905770 ecr 4160162047], length 304
06:56:03.779575 IP ubuntu-s-1vcpu-1gb-tor1-01.ssh > 162.243.188.66.2328: Flags [P.], seq 148896:149136, ack 1, win 502, options [nop,nop,TS val 1107905770 ecr 4160162047], length 240
06:56:03.779625 IP ubuntu-s-1vcpu-1gb-tor1-01.ssh > 162.243.188.66.2328: Flags [P.], seq 149136:149376, ack 1, win 502, options [nop,nop,TS val 1107905770 ecr 4160162047], length 240
06:56:03.779677 IP ubuntu-s-1vcpu-1gb-tor1-01.ssh > 162.243.188.66.2328: Flags [P.], seq 149376:149792, ack 1, win 502, options [nop,nop,TS val 1107905770 ecr 4160162047], length 416
06:56:03.779736 IP ubuntu-s-1vcpu-1gb-tor1-01.ssh > 162.243.188.66.2328: Flags [P.], seq 149792:150016, ack 1, win 502, options [nop,nop,TS val 1107905770 ecr 4160162047], length 224
06:56:03.794098 IP 162.243.188.66.2328 > ubuntu-s-1vcpu-1gb-tor1-01.ssh: Flags [.], ack 149376, win 4179, options [nop,nop,TS val 4160162151 ecr 1107905770], length 0
06:56:03.798681 IP 45-79-109-130.ip.linodeusercontent.com.45535 > ubuntu-s-1vcpu-1gb-tor1-01.83: Flags [S], seq 1534766635, win 65535, options [mss 1460], length 0
06:56:03.798713 IP ubuntu-s-1vcpu-1gb-tor1-01.83 > 45-79-109-130.ip.linodeusercontent.com.45535: Flags [R.], seq 0, ack 1534766636, win 0, length 0
06:56:03.814887 IP 162.243.188.66.2328 > ubuntu-s-1vcpu-1gb-tor1-01.ssh: Flags [.], ack 150016, win 4193, options [nop,nop,TS val 4160162172 ecr 1107905770], length 0
06:56:03.883290 IP ubuntu-s-1vcpu-1gb-tor1-01.ssh > 162.243.188.66.2328: Flags [P.], seq 150016:150256, ack 1, win 502, options [nop,nop,TS val 1107905874 ecr 4160162172], length 240
06:56:03.883415 IP ubuntu-s-1vcpu-1gb-tor1-01.ssh > 162.243.188.66.2328: Flags [P.], seq 150256:150928, ack 1, win 502, options [nop,nop,TS val 1107905874 ecr 4160162172], length 672
06:56:03.883487 IP ubuntu-s-1vcpu-1gb-tor1-01.ssh > 162.243.188.66.2328: Flags [P.], seq 150928:151168, ack 1, win 502, options [nop,nop,TS val 1107905874 ecr 4160162172], length 240
06:56:03.883519 IP ubuntu-s-1vcpu-1gb-tor1-01.ssh > 162.243.188.66.2328: Flags [P.], seq 151168:151600, ack 1, win 502, options [nop,nop,TS val 1107905874 ecr 4160162172], length 432
06:56:03.883595 IP ubuntu-s-1vcpu-1gb-tor1-01.ssh > 162.243.188.66.2328: Flags [P.], seq 151600:152064, ack 1, win 502, options [nop,nop,TS val 1107905874 ecr 4160162172], length 464
06:56:03.884033 IP ubuntu-s-1vcpu-1gb-tor1-01.33249 > 67.207.67.2.domain: 8162+ [1au] PTR? 130.109.79.45.in-addr.arpa. (55)
06:56:03.884088 IP ubuntu-s-1vcpu-1gb-tor1-01.37141 > 67.207.67.2.domain: 38683+ [1au] PTR? 130.109.79.45.in-addr.arpa. (55)
06:56:03.884158 IP ubuntu-s-1vcpu-1gb-tor1-01.42168 > 67.207.67.2.domain: Flags [P.], seq 138:184, ack 324, win 502, options [nop,nop,TS val 979443127 ecr 2080124367], length 46 62356+ PTR? 130.109.79.45.in-addr.arpa. (44)
06:56:03.884222 IP ubuntu-s-1vcpu-1gb-tor1-01.ssh > 162.243.188.66.2328: Flags [P.], seq 152064:152128, ack 1, win 502, options [nop,nop,TS val 1107905875 ecr 4160162172], length 64
06:56:03.884662 IP 67.207.67.2.domain > ubuntu-s-1vcpu-1gb-tor1-01.42168: Flags [P.], seq 324:422, ack 184, win 128, options [nop,nop,TS val 2080124886 ecr 979443127], length 98 62356 1/0/0 PTR 45-79-109-130.ip.linodeusercontent.com. (96)
06:56:03.884679 IP ubuntu-s-1vcpu-1gb-tor1-01.42168 > 67.207.67.2.domain: Flags [.], ack 422, win 502, options [nop,nop,TS val 979443127 ecr 2080124886], length 0
06:56:03.885138 IP ubuntu-s-1vcpu-1gb-tor1-01.ssh > 162.243.188.66.2328: Flags [P.], seq 152128:152352, ack 1, win 502, options [nop,nop,TS val 1107905876 ecr 4160162172], length 224
06:56:03.885228 IP ubuntu-s-1vcpu-1gb-tor1-01.ssh > 162.243.188.66.2328: Flags [P.], seq 152352:152624, ack 1, win 502, options [nop,nop,TS val 1107905876 ecr 4160162172], length 272
06:56:03.885296 IP ubuntu-s-1vcpu-1gb-tor1-01.ssh > 162.243.188.66.2328: Flags [P.], seq 152624:152912, ack 1, win 502, options [nop,nop,TS val 1107905876 ecr 4160162172], length 288
06:56:03.885432 IP ubuntu-s-1vcpu-1gb-tor1-01.ssh > 162.243.188.66.2328: Flags [P.], seq 152912:152976, ack 1, win 502, options [nop,nop,TS val 1107905876 ecr 4160162172], length 64
06:56:03.898235 IP 162.243.188.66.2328 > ubuntu-s-1vcpu-1gb-tor1-01.ssh: Flags [.], ack 151600, win 4182, options [nop,nop,TS val 4160162255 ecr 1107905874], length 0
06:56:03.898330 IP 67.207.67.2.domain > ubuntu-s-1vcpu-1gb-tor1-01.37141: 38683 1/0/1 PTR 45-79-109-130.ip.linodeusercontent.com. (107)
06:56:03.910392 IP 162.243.188.66.2328 > ubuntu-s-1vcpu-1gb-tor1-01.ssh: Flags [.], ack 152976, win 4193, options [nop,nop,TS val 4160162268 ecr 1107905874], length 0
06:56:03.920397 IP 67.207.67.2.domain > ubuntu-s-1vcpu-1gb-tor1-01.33249: 8162 1/0/1 PTR 45-79-109-130.ip.linodeusercontent.com. (107)
06:56:03.987314 IP ubuntu-s-1vcpu-1gb-tor1-01.ssh > 162.243.188.66.2328: Flags [P.], seq 152976:153216, ack 1, win 502, options [nop,nop,TS val 1107905978 ecr 4160162268], length 240
06:56:03.987417 IP ubuntu-s-1vcpu-1gb-tor1-01.ssh > 162.243.188.66.2328: Flags [P.], seq 153216:153520, ack 1, win 502, options [nop,nop,TS val 1107905978 ecr 4160162268], length 304
06:56:03.987510 IP ubuntu-s-1vcpu-1gb-tor1-01.ssh > 162.243.188.66.2328: Flags [P.], seq 153520:153888, ack 1, win 502, options [nop,nop,TS val 1107905978 ecr 4160162268], length 368
06:56:03.987587 IP ubuntu-s-1vcpu-1gb-tor1-01.ssh > 162.243.188.66.2328: Flags [P.], seq 153888:154432, ack 1, win 502, options [nop,nop,TS val 1107905978 ecr 4160162268], length 544
06:56:03.987656 IP ubuntu-s-1vcpu-1gb-tor1-01.ssh > 162.243.188.66.2328: Flags [P.], seq 154432:154496, ack 1, win 502, options [nop,nop,TS val 1107905978 ecr 4160162268], length 64
06:56:03.987712 IP ubuntu-s-1vcpu-1gb-tor1-01.ssh > 162.243.188.66.2328: Flags [P.], seq 154496:154864, ack 1, win 502, options [nop,nop,TS val 1107905978 ecr 4160162268], length 368
06:56:03.987769 IP ubuntu-s-1vcpu-1gb-tor1-01.ssh > 162.243.188.66.2328: Flags [P.], seq 154864:155136, ack 1, win 502, options [nop,nop,TS val 1107905978 ecr 4160162268], length 272
06:56:03.987829 IP ubuntu-s-1vcpu-1gb-tor1-01.ssh > 162.243.188.66.2328: Flags [P.], seq 155136:155376, ack 1, win 502, options [nop,nop,TS val 1107905978 ecr 4160162268], length 240
06:56:03.987887 IP ubuntu-s-1vcpu-1gb-tor1-01.ssh > 162.243.188.66.2328: Flags [P.], seq 155376:155840, ack 1, win 502, options [nop,nop,TS val 1107905978 ecr 4160162268], length 464
06:56:03.987936 IP ubuntu-s-1vcpu-1gb-tor1-01.ssh > 162.243.188.66.2328: Flags [P.], seq 155840:156272, ack 1, win 502, options [nop,nop,TS val 1107905978 ecr 4160162268], length 432
06:56:03.988005 IP ubuntu-s-1vcpu-1gb-tor1-01.ssh > 162.243.188.66.2328: Flags [P.], seq 156272:156512, ack 1, win 502, options [nop,nop,TS val 1107905978 ecr 4160162268], length 240
06:56:03.988058 IP ubuntu-s-1vcpu-1gb-tor1-01.ssh > 162.243.188.66.2328: Flags [P.], seq 156512:156576, ack 1, win 502, options [nop,nop,TS val 1107905979 ecr 4160162268], length 64
06:56:03.988124 IP ubuntu-s-1vcpu-1gb-tor1-01.ssh > 162.243.188.66.2328: Flags [P.], seq 156576:156976, ack 1, win 502, options [nop,nop,TS val 1107905979 ecr 4160162268], length 400
06:56:03.988178 IP ubuntu-s-1vcpu-1gb-tor1-01.ssh > 162.243.188.66.2328: Flags [P.], seq 156976:157168, ack 1, win 502, options [nop,nop,TS val 1107905979 ecr 4160162268], length 192
06:56:03.988238 IP ubuntu-s-1vcpu-1gb-tor1-01.ssh > 162.243.188.66.2328: Flags [P.], seq 157168:157392, ack 1, win 502, options [nop,nop,TS val 1107905979 ecr 4160162268], length 224
06:56:03.988302 IP ubuntu-s-1vcpu-1gb-tor1-01.ssh > 162.243.188.66.2328: Flags [P.], seq 157392:157648, ack 1, win 502, options [nop,nop,TS val 1107905979 ecr 4160162268], length 256
06:56:04.002171 IP 162.243.188.66.2328 > ubuntu-s-1vcpu-1gb-tor1-01.ssh: Flags [.], ack 154432, win 4183, options [nop,nop,TS val 4160162359 ecr 1107905978], length 0
06:56:04.002326 IP 162.243.188.66.2328 > ubuntu-s-1vcpu-1gb-tor1-01.ssh: Flags [.], ack 156272, win 4169, options [nop,nop,TS val 4160162360 ecr 1107905978], length 0
06:56:04.030768 IP 162.243.188.66.2328 > ubuntu-s-1vcpu-1gb-tor1-01.ssh: Flags [.], ack 157648, win 4193, options [nop,nop,TS val 4160162388 ecr 1107905978], length 0
06:56:04.091337 IP ubuntu-s-1vcpu-1gb-tor1-01.ssh > 162.243.188.66.2328: Flags [P.], seq 157648:157888, ack 1, win 502, options [nop,nop,TS val 1107906082 ecr 4160162388], length 240
06:56:04.091464 IP ubuntu-s-1vcpu-1gb-tor1-01.ssh > 162.243.188.66.2328: Flags [P.], seq 157888:158192, ack 1, win 502, options [nop,nop,TS val 1107906082 ecr 4160162388], length 304
06:56:04.091567 IP ubuntu-s-1vcpu-1gb-tor1-01.ssh > 162.243.188.66.2328: Flags [P.], seq 158192:158432, ack 1, win 502, options [nop,nop,TS val 1107906082 ecr 4160162388], length 240
06:56:04.091641 IP ubuntu-s-1vcpu-1gb-tor1-01.ssh > 162.243.188.66.2328: Flags [P.], seq 158432:158736, ack 1, win 502, options [nop,nop,TS val 1107906082 ecr 4160162388], length 304
06:56:04.091730 IP ubuntu-s-1vcpu-1gb-tor1-01.ssh > 162.243.188.66.2328: Flags [P.], seq 158736:158976, ack 1, win 502, options [nop,nop,TS val 1107906082 ecr 4160162388], length 240
06:56:04.091817 IP ubuntu-s-1vcpu-1gb-tor1-01.ssh > 162.243.188.66.2328: Flags [P.], seq 158976:159216, ack 1, win 502, options [nop,nop,TS val 1107906082 ecr 4160162388], length 240
06:56:04.091936 IP ubuntu-s-1vcpu-1gb-tor1-01.ssh > 162.243.188.66.2328: Flags [P.], seq 159216:159456, ack 1, win 502, options [nop,nop,TS val 1107906082 ecr 4160162388], length 240
06:56:04.092025 IP ubuntu-s-1vcpu-1gb-tor1-01.ssh > 162.243.188.66.2328: Flags [P.], seq 159456:159696, ack 1, win 502, options [nop,nop,TS val 1107906082 ecr 4160162388], length 240
06:56:04.092102 IP ubuntu-s-1vcpu-1gb-tor1-01.ssh > 162.243.188.66.2328: Flags [P.], seq 159696:160000, ack 1, win 502, options [nop,nop,TS val 1107906083 ecr 4160162388], length 304
06:56:04.092188 IP ubuntu-s-1vcpu-1gb-tor1-01.ssh > 162.243.188.66.2328: Flags [P.], seq 160000:160064, ack 1, win 502, options [nop,nop,TS val 1107906083 ecr 4160162388], length 64
06:56:04.092207 IP ubuntu-s-1vcpu-1gb-tor1-01.ssh > 162.243.188.66.2328: Flags [P.], seq 160064:160304, ack 1, win 502, options [nop,nop,TS val 1107906083 ecr 4160162388], length 240
06:56:04.092297 IP ubuntu-s-1vcpu-1gb-tor1-01.ssh > 162.243.188.66.2328: Flags [P.], seq 160304:160736, ack 1, win 502, options [nop,nop,TS val 1107906083 ecr 4160162388], length 432
06:56:04.092402 IP ubuntu-s-1vcpu-1gb-tor1-01.ssh > 162.243.188.66.2328: Flags [P.], seq 160736:160976, ack 1, win 502, options [nop,nop,TS val 1107906083 ecr 4160162388], length 240
06:56:04.092486 IP ubuntu-s-1vcpu-1gb-tor1-01.ssh > 162.243.188.66.2328: Flags [P.], seq 160976:161216, ack 1, win 502, options [nop,nop,TS val 1107906083 ecr 4160162388], length 240
06:56:04.092568 IP ubuntu-s-1vcpu-1gb-tor1-01.ssh > 162.243.188.66.2328: Flags [P.], seq 161216:161456, ack 1, win 502, options [nop,nop,TS val 1107906083 ecr 4160162388], length 240
06:56:04.092617 IP ubuntu-s-1vcpu-1gb-tor1-01.ssh > 162.243.188.66.2328: Flags [P.], seq 161456:162032, ack 1, win 502, options [nop,nop,TS val 1107906083 ecr 4160162388], length 576
06:56:04.092715 IP ubuntu-s-1vcpu-1gb-tor1-01.ssh > 162.243.188.66.2328: Flags [P.], seq 162032:162256, ack 1, win 502, options [nop,nop,TS val 1107906083 ecr 4160162388], length 224
06:56:04.093002 IP ubuntu-s-1vcpu-1gb-tor1-01.ssh > 162.243.188.66.2328: Flags [P.], seq 162256:162320, ack 1, win 502, options [nop,nop,TS val 1107906083 ecr 4160162388], length 64
06:56:04.107414 IP 162.243.188.66.2328 > ubuntu-s-1vcpu-1gb-tor1-01.ssh: Flags [.], ack 159216, win 4181, options [nop,nop,TS val 4160162463 ecr 1107906082], length 0
06:56:04.107808 IP 162.243.188.66.2328 > ubuntu-s-1vcpu-1gb-tor1-01.ssh: Flags [.], ack 160736, win 4170, options [nop,nop,TS val 4160162464 ecr 1107906082], length 0
06:56:04.109815 IP 162.243.188.66.2328 > ubuntu-s-1vcpu-1gb-tor1-01.ssh: Flags [.], ack 162256, win 4159, options [nop,nop,TS val 4160162465 ecr 1107906083], length 0
06:56:04.132151 IP 162.243.188.66.2328 > ubuntu-s-1vcpu-1gb-tor1-01.ssh: Flags [.], ack 162320, win 4193, options [nop,nop,TS val 4160162489 ecr 1107906083], length 0
06:56:04.195318 IP ubuntu-s-1vcpu-1gb-tor1-01.ssh > 162.243.188.66.2328: Flags [P.], seq 162320:162560, ack 1, win 502, options [nop,nop,TS val 1107906186 ecr 4160162489], length 240
06:56:04.195470 IP ubuntu-s-1vcpu-1gb-tor1-01.ssh > 162.243.188.66.2328: Flags [P.], seq 162560:162800, ack 1, win 502, options [nop,nop,TS val 1107906186 ecr 4160162489], length 240
06:56:04.195521 IP ubuntu-s-1vcpu-1gb-tor1-01.ssh > 162.243.188.66.2328: Flags [P.], seq 162800:163232, ack 1, win 502, options [nop,nop,TS val 1107906186 ecr 4160162489], length 432
06:56:04.195590 IP ubuntu-s-1vcpu-1gb-tor1-01.ssh > 162.243.188.66.2328: Flags [P.], seq 163232:163296, ack 1, win 502, options [nop,nop,TS val 1107906186 ecr 4160162489], length 64
06:56:04.195627 IP ubuntu-s-1vcpu-1gb-tor1-01.ssh > 162.243.188.66.2328: Flags [P.], seq 163296:163536, ack 1, win 502, options [nop,nop,TS val 1107906186 ecr 4160162489], length 240
06:56:04.195713 IP ubuntu-s-1vcpu-1gb-tor1-01.ssh > 162.243.188.66.2328: Flags [P.], seq 163536:163968, ack 1, win 502, options [nop,nop,TS val 1107906186 ecr 4160162489], length 432
06:56:04.195800 IP ubuntu-s-1vcpu-1gb-tor1-01.ssh > 162.243.188.66.2328: Flags [P.], seq 163968:164400, ack 1, win 502, options [nop,nop,TS val 1107906186 ecr 4160162489], length 432
06:56:04.195933 IP ubuntu-s-1vcpu-1gb-tor1-01.ssh > 162.243.188.66.2328: Flags [P.], seq 164400:165072, ack 1, win 502, options [nop,nop,TS val 1107906186 ecr 4160162489], length 672
06:56:04.196204 IP ubuntu-s-1vcpu-1gb-tor1-01.ssh > 162.243.188.66.2328: Flags [P.], seq 165072:165312, ack 1, win 502, options [nop,nop,TS val 1107906187 ecr 4160162489], length 240
06:56:04.196304 IP ubuntu-s-1vcpu-1gb-tor1-01.ssh > 162.243.188.66.2328: Flags [P.], seq 165312:165744, ack 1, win 502, options [nop,nop,TS val 1107906187 ecr 4160162489], length 432
06:56:04.196397 IP ubuntu-s-1vcpu-1gb-tor1-01.ssh > 162.243.188.66.2328: Flags [P.], seq 165744:166176, ack 1, win 502, options [nop,nop,TS val 1107906187 ecr 4160162489], length 432
06:56:04.196492 IP ubuntu-s-1vcpu-1gb-tor1-01.ssh > 162.243.188.66.2328: Flags [P.], seq 166176:166576, ack 1, win 502, options [nop,nop,TS val 1107906187 ecr 4160162489], length 400
06:56:04.196570 IP ubuntu-s-1vcpu-1gb-tor1-01.ssh > 162.243.188.66.2328: Flags [P.], seq 166576:166800, ack 1, win 502, options [nop,nop,TS val 1107906187 ecr 4160162489], length 224
06:56:04.196638 IP ubuntu-s-1vcpu-1gb-tor1-01.ssh > 162.243.188.66.2328: Flags [P.], seq 166800:167024, ack 1, win 502, options [nop,nop,TS val 1107906187 ecr 4160162489], length 224
06:56:04.196705 IP ubuntu-s-1vcpu-1gb-tor1-01.ssh > 162.243.188.66.2328: Flags [P.], seq 167024:167312, ack 1, win 502, options [nop,nop,TS val 1107906187 ecr 4160162489], length 288
06:56:04.210040 IP 162.243.188.66.2328 > ubuntu-s-1vcpu-1gb-tor1-01.ssh: Flags [.], ack 163968, win 4181, options [nop,nop,TS val 4160162567 ecr 1107906186], length 0
06:56:04.210654 IP 162.243.188.66.2328 > ubuntu-s-1vcpu-1gb-tor1-01.ssh: Flags [.], ack 165744, win 4168, options [nop,nop,TS val 4160162568 ecr 1107906186], length 0
06:56:04.211036 IP 162.243.188.66.2328 > ubuntu-s-1vcpu-1gb-tor1-01.ssh: Flags [.], ack 167312, win 4156, options [nop,nop,TS val 4160162568 ecr 1107906187], length 0
06:56:04.299293 IP ubuntu-s-1vcpu-1gb-tor1-01.ssh > 162.243.188.66.2328: Flags [P.], seq 167312:167552, ack 1, win 502, options [nop,nop,TS val 1107906290 ecr 4160162568], length 240
06:56:04.299375 IP ubuntu-s-1vcpu-1gb-tor1-01.ssh > 162.243.188.66.2328: Flags [P.], seq 167552:167856, ack 1, win 502, options [nop,nop,TS val 1107906290 ecr 4160162568], length 304
06:56:04.299430 IP ubuntu-s-1vcpu-1gb-tor1-01.ssh > 162.243.188.66.2328: Flags [P.], seq 167856:168096, ack 1, win 502, options [nop,nop,TS val 1107906290 ecr 4160162568], length 240
06:56:04.299487 IP ubuntu-s-1vcpu-1gb-tor1-01.ssh > 162.243.188.66.2328: Flags [P.], seq 168096:168400, ack 1, win 502, options [nop,nop,TS val 1107906290 ecr 4160162568], length 304
06:56:04.299540 IP ubuntu-s-1vcpu-1gb-tor1-01.ssh > 162.243.188.66.2328: Flags [P.], seq 168400:168640, ack 1, win 502, options [nop,nop,TS val 1107906290 ecr 4160162568], length 240
06:56:04.299590 IP ubuntu-s-1vcpu-1gb-tor1-01.ssh > 162.243.188.66.2328: Flags [P.], seq 168640:168880, ack 1, win 502, options [nop,nop,TS val 1107906290 ecr 4160162568], length 240
06:56:04.299641 IP ubuntu-s-1vcpu-1gb-tor1-01.ssh > 162.243.188.66.2328: Flags [P.], seq 168880:169120, ack 1, win 502, options [nop,nop,TS val 1107906290 ecr 4160162568], length 240
06:56:04.299694 IP ubuntu-s-1vcpu-1gb-tor1-01.ssh > 162.243.188.66.2328: Flags [P.], seq 169120:169552, ack 1, win 502, options [nop,nop,TS val 1107906290 ecr 4160162568], length 432
06:56:04.299744 IP ubuntu-s-1vcpu-1gb-tor1-01.ssh > 162.243.188.66.2328: Flags [P.], seq 169552:169984, ack 1, win 502, options [nop,nop,TS val 1107906290 ecr 4160162568], length 432
06:56:04.299802 IP ubuntu-s-1vcpu-1gb-tor1-01.ssh > 162.243.188.66.2328: Flags [P.], seq 169984:170464, ack 1, win 502, options [nop,nop,TS val 1107906290 ecr 4160162568], length 480
06:56:04.299872 IP ubuntu-s-1vcpu-1gb-tor1-01.ssh > 162.243.188.66.2328: Flags [P.], seq 170464:170896, ack 1, win 502, options [nop,nop,TS val 1107906290 ecr 4160162568], length 432
06:56:04.299934 IP ubuntu-s-1vcpu-1gb-tor1-01.ssh > 162.243.188.66.2328: Flags [P.], seq 170896:171120, ack 1, win 502, options [nop,nop,TS val 1107906290 ecr 4160162568], length 224
06:56:04.299985 IP ubuntu-s-1vcpu-1gb-tor1-01.ssh > 162.243.188.66.2328: Flags [P.], seq 171120:171344, ack 1, win 502, options [nop,nop,TS val 1107906290 ecr 4160162568], length 224
06:56:04.300036 IP ubuntu-s-1vcpu-1gb-tor1-01.ssh > 162.243.188.66.2328: Flags [P.], seq 171344:171568, ack 1, win 502, options [nop,nop,TS val 1107906290 ecr 4160162568], length 224
06:56:04.300096 IP ubuntu-s-1vcpu-1gb-tor1-01.ssh > 162.243.188.66.2328: Flags [P.], seq 171568:171632, ack 1, win 502, options [nop,nop,TS val 1107906291 ecr 4160162568], length 64
06:56:04.314084 IP 162.243.188.66.2328 > ubuntu-s-1vcpu-1gb-tor1-01.ssh: Flags [.], ack 168880, win 4179, options [nop,nop,TS val 4160162671 ecr 1107906290], length 0
06:56:04.314154 IP 162.243.188.66.2328 > ubuntu-s-1vcpu-1gb-tor1-01.ssh: Flags [.], ack 170464, win 4167, options [nop,nop,TS val 4160162671 ecr 1107906290], length 0
06:56:04.328917 IP 182.2.49.71 > ubuntu-s-1vcpu-1gb-tor1-01: ICMP echo request, id 47624, seq 3, length 64
06:56:04.328947 IP ubuntu-s-1vcpu-1gb-tor1-01 > 182.2.49.71: ICMP echo reply, id 47624, seq 3, length 64
06:56:04.350571 IP 162.243.188.66.2328 > ubuntu-s-1vcpu-1gb-tor1-01.ssh: Flags [.], ack 171632, win 4193, options [nop,nop,TS val 4160162708 ecr 1107906290], length 0
06:56:04.403330 IP ubuntu-s-1vcpu-1gb-tor1-01.ssh > 162.243.188.66.2328: Flags [P.], seq 171632:171872, ack 1, win 502, options [nop,nop,TS val 1107906394 ecr 4160162708], length 240
06:56:04.403445 IP ubuntu-s-1vcpu-1gb-tor1-01.ssh > 162.243.188.66.2328: Flags [P.], seq 171872:172176, ack 1, win 502, options [nop,nop,TS val 1107906394 ecr 4160162708], length 304
06:56:04.403627 IP ubuntu-s-1vcpu-1gb-tor1-01.ssh > 162.243.188.66.2328: Flags [P.], seq 172176:172608, ack 1, win 502, options [nop,nop,TS val 1107906394 ecr 4160162708], length 432
06:56:04.403854 IP ubuntu-s-1vcpu-1gb-tor1-01.ssh > 162.243.188.66.2328: Flags [P.], seq 172608:174144, ack 1, win 502, options [nop,nop,TS val 1107906394 ecr 4160162708], length 1536
06:56:04.403962 IP ubuntu-s-1vcpu-1gb-tor1-01.ssh > 162.243.188.66.2328: Flags [P.], seq 174144:174752, ack 1, win 502, options [nop,nop,TS val 1107906394 ecr 4160162708], length 608
06:56:04.404447 IP ubuntu-s-1vcpu-1gb-tor1-01.53721 > 67.207.67.2.domain: 52061+ [1au] PTR? 71.49.2.182.in-addr.arpa. (53)
06:56:04.404526 IP ubuntu-s-1vcpu-1gb-tor1-01.45187 > 67.207.67.2.domain: 28803+ [1au] PTR? 71.49.2.182.in-addr.arpa. (53)
06:56:04.404602 IP ubuntu-s-1vcpu-1gb-tor1-01.42168 > 67.207.67.2.domain: Flags [P.], seq 184:228, ack 422, win 502, options [nop,nop,TS val 979443647 ecr 2080124886], length 44 13485+ PTR? 71.49.2.182.in-addr.arpa. (42)
06:56:04.404676 IP ubuntu-s-1vcpu-1gb-tor1-01.ssh > 162.243.188.66.2328: Flags [P.], seq 174752:175152, ack 1, win 502, options [nop,nop,TS val 1107906395 ecr 4160162708], length 400
06:56:04.406048 IP 67.207.67.2.domain > ubuntu-s-1vcpu-1gb-tor1-01.45187: 28803 NXDomain 0/1/1 (141)
06:56:04.406097 IP 67.207.67.2.domain > ubuntu-s-1vcpu-1gb-tor1-01.53721: 52061 NXDomain 0/1/1 (141)
06:56:04.406188 IP ubuntu-s-1vcpu-1gb-tor1-01.45187 > 67.207.67.2.domain: 28803+ PTR? 71.49.2.182.in-addr.arpa. (42)
06:56:04.406255 IP ubuntu-s-1vcpu-1gb-tor1-01.53721 > 67.207.67.2.domain: 52061+ PTR? 71.49.2.182.in-addr.arpa. (42)
06:56:04.407162 IP 67.207.67.2.domain > ubuntu-s-1vcpu-1gb-tor1-01.45187: 28803 NXDomain 0/1/0 (130)
06:56:04.418280 IP 162.243.188.66.2328 > ubuntu-s-1vcpu-1gb-tor1-01.ssh: Flags [.], ack 174144, win 4177, options [nop,nop,TS val 4160162775 ecr 1107906394], length 0
06:56:04.445122 IP 67.207.67.2.domain > ubuntu-s-1vcpu-1gb-tor1-01.42168: Flags [.], ack 228, win 128, options [nop,nop,TS val 2080125446 ecr 979443647], length 0
06:56:04.459427 IP 67.207.67.2.domain > ubuntu-s-1vcpu-1gb-tor1-01.53721: 52061 NXDomain 0/1/0 (130)
06:56:04.459522 IP 67.207.67.2.domain > ubuntu-s-1vcpu-1gb-tor1-01.42168: Flags [P.], seq 422:554, ack 228, win 128, options [nop,nop,TS val 2080125461 ecr 979443647], length 132 13485 NXDomain 0/1/0 (130)
06:56:04.459542 IP ubuntu-s-1vcpu-1gb-tor1-01.42168 > 67.207.67.2.domain: Flags [.], ack 554, win 501, options [nop,nop,TS val 979443702 ecr 2080125461], length 0
06:56:04.459657 IP 162.243.188.66.2328 > ubuntu-s-1vcpu-1gb-tor1-01.ssh: Flags [.], ack 175152, win 4193, options [nop,nop,TS val 4160162817 ecr 1107906394], length 0
06:56:04.460056 IP ubuntu-s-1vcpu-1gb-tor1-01.ssh > 162.243.188.66.2328: Flags [P.], seq 175152:175312, ack 1, win 502, options [nop,nop,TS val 1107906451 ecr 4160162817], length 160
06:56:04.460181 IP ubuntu-s-1vcpu-1gb-tor1-01.ssh > 162.243.188.66.2328: Flags [P.], seq 175312:175376, ack 1, win 502, options [nop,nop,TS val 1107906451 ecr 4160162817], length 64
06:56:04.460219 IP ubuntu-s-1vcpu-1gb-tor1-01.ssh > 162.243.188.66.2328: Flags [P.], seq 175376:175536, ack 1, win 502, options [nop,nop,TS val 1107906451 ecr 4160162817], length 160
06:56:04.460271 IP ubuntu-s-1vcpu-1gb-tor1-01.ssh > 162.243.188.66.2328: Flags [P.], seq 175536:175600, ack 1, win 502, options [nop,nop,TS val 1107906451 ecr 4160162817], length 64
06:56:04.460341 IP ubuntu-s-1vcpu-1gb-tor1-01.ssh > 162.243.188.66.2328: Flags [P.], seq 175600:175824, ack 1, win 502, options [nop,nop,TS val 1107906451 ecr 4160162817], length 224
06:56:04.460418 IP ubuntu-s-1vcpu-1gb-tor1-01.ssh > 162.243.188.66.2328: Flags [P.], seq 175824:175888, ack 1, win 502, options [nop,nop,TS val 1107906451 ecr 4160162817], length 64
06:56:04.479423 IP 162.243.188.66.2328 > ubuntu-s-1vcpu-1gb-tor1-01.ssh: Flags [.], ack 175888, win 4193, options [nop,nop,TS val 4160162837 ecr 1107906451], length 0
06:56:04.507454 IP ubuntu-s-1vcpu-1gb-tor1-01.ssh > 162.243.188.66.2328: Flags [P.], seq 175888:176128, ack 1, win 502, options [nop,nop,TS val 1107906498 ecr 4160162837], length 240
06:56:04.507544 IP ubuntu-s-1vcpu-1gb-tor1-01.ssh > 162.243.188.66.2328: Flags [P.], seq 176128:176432, ack 1, win 502, options [nop,nop,TS val 1107906498 ecr 4160162837], length 304
06:56:04.507628 IP ubuntu-s-1vcpu-1gb-tor1-01.ssh > 162.243.188.66.2328: Flags [P.], seq 176432:176736, ack 1, win 502, options [nop,nop,TS val 1107906498 ecr 4160162837], length 304
06:56:04.507710 IP ubuntu-s-1vcpu-1gb-tor1-01.ssh > 162.243.188.66.2328: Flags [P.], seq 176736:177040, ack 1, win 502, options [nop,nop,TS val 1107906498 ecr 4160162837], length 304
06:56:04.507764 IP ubuntu-s-1vcpu-1gb-tor1-01.ssh > 162.243.188.66.2328: Flags [P.], seq 177040:177344, ack 1, win 502, options [nop,nop,TS val 1107906498 ecr 4160162837], length 304
06:56:04.507816 IP ubuntu-s-1vcpu-1gb-tor1-01.ssh > 162.243.188.66.2328: Flags [P.], seq 177344:177520, ack 1, win 502, options [nop,nop,TS val 1107906498 ecr 4160162837], length 176
06:56:04.507907 IP ubuntu-s-1vcpu-1gb-tor1-01.ssh > 162.243.188.66.2328: Flags [P.], seq 177520:177584, ack 1, win 502, options [nop,nop,TS val 1107906498 ecr 4160162837], length 64
06:56:04.507944 IP ubuntu-s-1vcpu-1gb-tor1-01.ssh > 162.243.188.66.2328: Flags [P.], seq 177584:177984, ack 1, win 502, options [nop,nop,TS val 1107906498 ecr 4160162837], length 400
06:56:04.508019 IP ubuntu-s-1vcpu-1gb-tor1-01.ssh > 162.243.188.66.2328: Flags [P.], seq 177984:178352, ack 1, win 502, options [nop,nop,TS val 1107906498 ecr 4160162837], length 368
06:56:04.508085 IP ubuntu-s-1vcpu-1gb-tor1-01.ssh > 162.243.188.66.2328: Flags [P.], seq 178352:178576, ack 1, win 502, options [nop,nop,TS val 1107906499 ecr 4160162837], length 224
06:56:04.508152 IP ubuntu-s-1vcpu-1gb-tor1-01.ssh > 162.243.188.66.2328: Flags [P.], seq 178576:179024, ack 1, win 502, options [nop,nop,TS val 1107906499 ecr 4160162837], length 448
06:56:04.508209 IP ubuntu-s-1vcpu-1gb-tor1-01.ssh > 162.243.188.66.2328: Flags [P.], seq 179024:179344, ack 1, win 502, options [nop,nop,TS val 1107906499 ecr 4160162837], length 320
06:56:04.508273 IP ubuntu-s-1vcpu-1gb-tor1-01.ssh > 162.243.188.66.2328: Flags [P.], seq 179344:179728, ack 1, win 502, options [nop,nop,TS val 1107906499 ecr 4160162837], length 384
06:56:04.508326 IP ubuntu-s-1vcpu-1gb-tor1-01.ssh > 162.243.188.66.2328: Flags [P.], seq 179728:180000, ack 1, win 502, options [nop,nop,TS val 1107906499 ecr 4160162837], length 272
06:56:04.508376 IP ubuntu-s-1vcpu-1gb-tor1-01.ssh > 162.243.188.66.2328: Flags [P.], seq 180000:180224, ack 1, win 502, options [nop,nop,TS val 1107906499 ecr 4160162837], length 224
06:56:04.508429 IP ubuntu-s-1vcpu-1gb-tor1-01.ssh > 162.243.188.66.2328: Flags [P.], seq 180224:180640, ack 1, win 502, options [nop,nop,TS val 1107906499 ecr 4160162837], length 416
06:56:04.508485 IP ubuntu-s-1vcpu-1gb-tor1-01.ssh > 162.243.188.66.2328: Flags [P.], seq 180640:181072, ack 1, win 502, options [nop,nop,TS val 1107906499 ecr 4160162837], length 432
06:56:04.508531 IP ubuntu-s-1vcpu-1gb-tor1-01.ssh > 162.243.188.66.2328: Flags [P.], seq 181072:181680, ack 1, win 502, options [nop,nop,TS val 1107906499 ecr 4160162837], length 608
06:56:04.508595 IP ubuntu-s-1vcpu-1gb-tor1-01.ssh > 162.243.188.66.2328: Flags [P.], seq 181680:181904, ack 1, win 502, options [nop,nop,TS val 1107906499 ecr 4160162837], length 224
06:56:04.522419 IP 162.243.188.66.2328 > ubuntu-s-1vcpu-1gb-tor1-01.ssh: Flags [.], ack 177344, win 4182, options [nop,nop,TS val 4160162879 ecr 1107906498], length 0
06:56:04.522578 IP 162.243.188.66.2328 > ubuntu-s-1vcpu-1gb-tor1-01.ssh: Flags [.], ack 179344, win 4167, options [nop,nop,TS val 4160162880 ecr 1107906498], length 0
06:56:04.522869 IP 162.243.188.66.2328 > ubuntu-s-1vcpu-1gb-tor1-01.ssh: Flags [.], ack 181072, win 4154, options [nop,nop,TS val 4160162880 ecr 1107906499], length 0
06:56:04.558400 IP 162.243.188.66.2328 > ubuntu-s-1vcpu-1gb-tor1-01.ssh: Flags [.], ack 181904, win 4193, options [nop,nop,TS val 4160162915 ecr 1107906499], length 0
06:56:04.611327 IP ubuntu-s-1vcpu-1gb-tor1-01.ssh > 162.243.188.66.2328: Flags [P.], seq 181904:182144, ack 1, win 502, options [nop,nop,TS val 1107906602 ecr 4160162915], length 240
06:56:04.611464 IP ubuntu-s-1vcpu-1gb-tor1-01.ssh > 162.243.188.66.2328: Flags [P.], seq 182144:182448, ack 1, win 502, options [nop,nop,TS val 1107906602 ecr 4160162915], length 304
06:56:04.611552 IP ubuntu-s-1vcpu-1gb-tor1-01.ssh > 162.243.188.66.2328: Flags [P.], seq 182448:182864, ack 1, win 502, options [nop,nop,TS val 1107906602 ecr 4160162915], length 416
06:56:04.611637 IP ubuntu-s-1vcpu-1gb-tor1-01.ssh > 162.243.188.66.2328: Flags [P.], seq 182864:183296, ack 1, win 502, options [nop,nop,TS val 1107906602 ecr 4160162915], length 432
06:56:04.611740 IP ubuntu-s-1vcpu-1gb-tor1-01.ssh > 162.243.188.66.2328: Flags [P.], seq 183296:183904, ack 1, win 502, options [nop,nop,TS val 1107906602 ecr 4160162915], length 608
06:56:04.611827 IP ubuntu-s-1vcpu-1gb-tor1-01.ssh > 162.243.188.66.2328: Flags [P.], seq 183904:184336, ack 1, win 502, options [nop,nop,TS val 1107906602 ecr 4160162915], length 432
06:56:04.611931 IP ubuntu-s-1vcpu-1gb-tor1-01.ssh > 162.243.188.66.2328: Flags [P.], seq 184336:184944, ack 1, win 502, options [nop,nop,TS val 1107906602 ecr 4160162915], length 608
06:56:04.612019 IP ubuntu-s-1vcpu-1gb-tor1-01.ssh > 162.243.188.66.2328: Flags [P.], seq 184944:185360, ack 1, win 502, options [nop,nop,TS val 1107906602 ecr 4160162915], length 416
06:56:04.612091 IP ubuntu-s-1vcpu-1gb-tor1-01.ssh > 162.243.188.66.2328: Flags [P.], seq 185360:185600, ack 1, win 502, options [nop,nop,TS val 1107906603 ecr 4160162915], length 240
06:56:04.612169 IP ubuntu-s-1vcpu-1gb-tor1-01.ssh > 162.243.188.66.2328: Flags [P.], seq 185600:185840, ack 1, win 502, options [nop,nop,TS val 1107906603 ecr 4160162915], length 240
06:56:04.612242 IP ubuntu-s-1vcpu-1gb-tor1-01.ssh > 162.243.188.66.2328: Flags [P.], seq 185840:186144, ack 1, win 502, options [nop,nop,TS val 1107906603 ecr 4160162915], length 304
06:56:04.612327 IP ubuntu-s-1vcpu-1gb-tor1-01.ssh > 162.243.188.66.2328: Flags [P.], seq 186144:186528, ack 1, win 502, options [nop,nop,TS val 1107906603 ecr 4160162915], length 384
06:56:04.612426 IP ubuntu-s-1vcpu-1gb-tor1-01.ssh > 162.243.188.66.2328: Flags [P.], seq 186528:186928, ack 1, win 502, options [nop,nop,TS val 1107906603 ecr 4160162915], length 400
06:56:04.626241 IP 162.243.188.66.2328 > ubuntu-s-1vcpu-1gb-tor1-01.ssh: Flags [.], ack 183904, win 4179, options [nop,nop,TS val 4160162983 ecr 1107906602], length 0
06:56:04.626327 IP 162.243.188.66.2328 > ubuntu-s-1vcpu-1gb-tor1-01.ssh: Flags [.], ack 185360, win 4168, options [nop,nop,TS val 4160162984 ecr 1107906602], length 0
06:56:04.627063 IP 162.243.188.66.2328 > ubuntu-s-1vcpu-1gb-tor1-01.ssh: Flags [.], ack 186928, win 4156, options [nop,nop,TS val 4160162984 ecr 1107906603], length 0
06:56:04.715330 IP ubuntu-s-1vcpu-1gb-tor1-01.ssh > 162.243.188.66.2328: Flags [P.], seq 186928:187168, ack 1, win 502, options [nop,nop,TS val 1107906706 ecr 4160162984], length 240
06:56:04.715516 IP ubuntu-s-1vcpu-1gb-tor1-01.ssh > 162.243.188.66.2328: Flags [P.], seq 187168:187408, ack 1, win 502, options [nop,nop,TS val 1107906706 ecr 4160162984], length 240
06:56:04.715635 IP ubuntu-s-1vcpu-1gb-tor1-01.ssh > 162.243.188.66.2328: Flags [P.], seq 187408:187648, ack 1, win 502, options [nop,nop,TS val 1107906706 ecr 4160162984], length 240
06:56:04.715707 IP ubuntu-s-1vcpu-1gb-tor1-01.ssh > 162.243.188.66.2328: Flags [P.], seq 187648:188448, ack 1, win 502, options [nop,nop,TS val 1107906706 ecr 4160162984], length 800
06:56:04.715813 IP ubuntu-s-1vcpu-1gb-tor1-01.ssh > 162.243.188.66.2328: Flags [P.], seq 188448:189056, ack 1, win 502, options [nop,nop,TS val 1107906706 ecr 4160162984], length 608
06:56:04.715902 IP ubuntu-s-1vcpu-1gb-tor1-01.ssh > 162.243.188.66.2328: Flags [P.], seq 189056:189488, ack 1, win 502, options [nop,nop,TS val 1107906706 ecr 4160162984], length 432
06:56:04.716010 IP ubuntu-s-1vcpu-1gb-tor1-01.ssh > 162.243.188.66.2328: Flags [P.], seq 189488:190064, ack 1, win 502, options [nop,nop,TS val 1107906706 ecr 4160162984], length 576
06:56:04.716105 IP ubuntu-s-1vcpu-1gb-tor1-01.ssh > 162.243.188.66.2328: Flags [P.], seq 190064:190288, ack 1, win 502, options [nop,nop,TS val 1107906707 ecr 4160162984], length 224
06:56:04.730130 IP 162.243.188.66.2328 > ubuntu-s-1vcpu-1gb-tor1-01.ssh: Flags [.], ack 188448, win 4182, options [nop,nop,TS val 4160163087 ecr 1107906706], length 0
06:56:04.730317 IP 162.243.188.66.2328 > ubuntu-s-1vcpu-1gb-tor1-01.ssh: Flags [.], ack 190064, win 4170, options [nop,nop,TS val 4160163088 ecr 1107906706], length 0
06:56:04.760693 IP 162.243.188.66.2328 > ubuntu-s-1vcpu-1gb-tor1-01.ssh: Flags [.], ack 190288, win 4193, options [nop,nop,TS val 4160163118 ecr 1107906707], length 0
06:56:04.819286 IP ubuntu-s-1vcpu-1gb-tor1-01.ssh > 162.243.188.66.2328: Flags [P.], seq 190288:190528, ack 1, win 502, options [nop,nop,TS val 1107906810 ecr 4160163118], length 240
06:56:04.819392 IP ubuntu-s-1vcpu-1gb-tor1-01.ssh > 162.243.188.66.2328: Flags [P.], seq 190528:191328, ack 1, win 502, options [nop,nop,TS val 1107906810 ecr 4160163118], length 800
06:56:04.819476 IP ubuntu-s-1vcpu-1gb-tor1-01.ssh > 162.243.188.66.2328: Flags [P.], seq 191328:191760, ack 1, win 502, options [nop,nop,TS val 1107906810 ecr 4160163118], length 432
06:56:04.819538 IP ubuntu-s-1vcpu-1gb-tor1-01.ssh > 162.243.188.66.2328: Flags [P.], seq 191760:192000, ack 1, win 502, options [nop,nop,TS val 1107906810 ecr 4160163118], length 240
06:56:04.819559 IP ubuntu-s-1vcpu-1gb-tor1-01.ssh > 162.243.188.66.2328: Flags [P.], seq 192000:192560, ack 1, win 502, options [nop,nop,TS val 1107906810 ecr 4160163118], length 560
06:56:04.819606 IP ubuntu-s-1vcpu-1gb-tor1-01.ssh > 162.243.188.66.2328: Flags [P.], seq 192560:192624, ack 1, win 502, options [nop,nop,TS val 1107906810 ecr 4160163118], length 64
06:56:04.833856 IP 162.243.188.66.2328 > ubuntu-s-1vcpu-1gb-tor1-01.ssh: Flags [.], ack 191760, win 4184, options [nop,nop,TS val 4160163191 ecr 1107906810], length 0
06:56:04.853557 IP 162.243.188.66.2328 > ubuntu-s-1vcpu-1gb-tor1-01.ssh: Flags [.], ack 192624, win 4193, options [nop,nop,TS val 4160163211 ecr 1107906810], length 0
06:56:04.923331 IP ubuntu-s-1vcpu-1gb-tor1-01.ssh > 162.243.188.66.2328: Flags [P.], seq 192624:192864, ack 1, win 502, options [nop,nop,TS val 1107906914 ecr 4160163211], length 240
06:56:04.923470 IP ubuntu-s-1vcpu-1gb-tor1-01.ssh > 162.243.188.66.2328: Flags [P.], seq 192864:193344, ack 1, win 502, options [nop,nop,TS val 1107906914 ecr 4160163211], length 480
06:56:04.923565 IP ubuntu-s-1vcpu-1gb-tor1-01.ssh > 162.243.188.66.2328: Flags [P.], seq 193344:193584, ack 1, win 502, options [nop,nop,TS val 1107906914 ecr 4160163211], length 240
06:56:04.923622 IP ubuntu-s-1vcpu-1gb-tor1-01.ssh > 162.243.188.66.2328: Flags [P.], seq 193584:194016, ack 1, win 502, options [nop,nop,TS val 1107906914 ecr 4160163211], length 432
06:56:04.923718 IP ubuntu-s-1vcpu-1gb-tor1-01.ssh > 162.243.188.66.2328: Flags [P.], seq 194016:194416, ack 1, win 502, options [nop,nop,TS val 1107906914 ecr 4160163211], length 400
06:56:04.923914 IP ubuntu-s-1vcpu-1gb-tor1-01.ssh > 162.243.188.66.2328: Flags [P.], seq 194416:194480, ack 1, win 502, options [nop,nop,TS val 1107906914 ecr 4160163211], length 64
06:56:04.938200 IP 162.243.188.66.2328 > ubuntu-s-1vcpu-1gb-tor1-01.ssh: Flags [.], ack 194416, win 4179, options [nop,nop,TS val 4160163295 ecr 1107906914], length 0
06:56:04.947034 IP 162.243.188.66.2328 > ubuntu-s-1vcpu-1gb-tor1-01.ssh: Flags [.], ack 194480, win 4193, options [nop,nop,TS val 4160163304 ecr 1107906914], length 0
06:56:05.027303 IP ubuntu-s-1vcpu-1gb-tor1-01.ssh > 162.243.188.66.2328: Flags [P.], seq 194480:194720, ack 1, win 502, options [nop,nop,TS val 1107907018 ecr 4160163304], length 240
06:56:05.027415 IP ubuntu-s-1vcpu-1gb-tor1-01.ssh > 162.243.188.66.2328: Flags [P.], seq 194720:195392, ack 1, win 502, options [nop,nop,TS val 1107907018 ecr 4160163304], length 672
06:56:05.027496 IP ubuntu-s-1vcpu-1gb-tor1-01.ssh > 162.243.188.66.2328: Flags [P.], seq 195392:195632, ack 1, win 502, options [nop,nop,TS val 1107907018 ecr 4160163304], length 240
06:56:05.027560 IP ubuntu-s-1vcpu-1gb-tor1-01.ssh > 162.243.188.66.2328: Flags [P.], seq 195632:195872, ack 1, win 502, options [nop,nop,TS val 1107907018 ecr 4160163304], length 240
06:56:05.027606 IP ubuntu-s-1vcpu-1gb-tor1-01.ssh > 162.243.188.66.2328: Flags [P.], seq 195872:196160, ack 1, win 502, options [nop,nop,TS val 1107907018 ecr 4160163304], length 288
06:56:05.027680 IP ubuntu-s-1vcpu-1gb-tor1-01.ssh > 162.243.188.66.2328: Flags [P.], seq 196160:196384, ack 1, win 502, options [nop,nop,TS val 1107907018 ecr 4160163304], length 224
06:56:05.042293 IP 162.243.188.66.2328 > ubuntu-s-1vcpu-1gb-tor1-01.ssh: Flags [.], ack 196384, win 4179, options [nop,nop,TS val 4160163399 ecr 1107907018], length 0
06:56:05.131356 IP ubuntu-s-1vcpu-1gb-tor1-01.ssh > 162.243.188.66.2328: Flags [P.], seq 196384:196624, ack 1, win 502, options [nop,nop,TS val 1107907122 ecr 4160163399], length 240
06:56:05.131472 IP ubuntu-s-1vcpu-1gb-tor1-01.ssh > 162.243.188.66.2328: Flags [P.], seq 196624:196928, ack 1, win 502, options [nop,nop,TS val 1107907122 ecr 4160163399], length 304
06:56:05.131551 IP ubuntu-s-1vcpu-1gb-tor1-01.ssh > 162.243.188.66.2328: Flags [P.], seq 196928:197168, ack 1, win 502, options [nop,nop,TS val 1107907122 ecr 4160163399], length 240
06:56:05.131628 IP ubuntu-s-1vcpu-1gb-tor1-01.ssh > 162.243.188.66.2328: Flags [P.], seq 197168:197232, ack 1, win 502, options [nop,nop,TS val 1107907122 ecr 4160163399], length 64
06:56:05.131652 IP ubuntu-s-1vcpu-1gb-tor1-01.ssh > 162.243.188.66.2328: Flags [P.], seq 197232:197472, ack 1, win 502, options [nop,nop,TS val 1107907122 ecr 4160163399], length 240
06:56:05.131743 IP ubuntu-s-1vcpu-1gb-tor1-01.ssh > 162.243.188.66.2328: Flags [P.], seq 197472:197904, ack 1, win 502, options [nop,nop,TS val 1107907122 ecr 4160163399], length 432
06:56:05.131831 IP ubuntu-s-1vcpu-1gb-tor1-01.ssh > 162.243.188.66.2328: Flags [P.], seq 197904:198128, ack 1, win 502, options [nop,nop,TS val 1107907122 ecr 4160163399], length 224
06:56:05.146990 IP 162.243.188.66.2328 > ubuntu-s-1vcpu-1gb-tor1-01.ssh: Flags [.], ack 197904, win 4179, options [nop,nop,TS val 4160163503 ecr 1107907122], length 0
06:56:05.157837 IP 162.243.188.66.2328 > ubuntu-s-1vcpu-1gb-tor1-01.ssh: Flags [.], ack 198128, win 4193, options [nop,nop,TS val 4160163515 ecr 1107907122], length 0
06:56:05.235349 IP ubuntu-s-1vcpu-1gb-tor1-01.ssh > 162.243.188.66.2328: Flags [P.], seq 198128:198368, ack 1, win 502, options [nop,nop,TS val 1107907226 ecr 4160163515], length 240
06:56:05.235521 IP ubuntu-s-1vcpu-1gb-tor1-01.ssh > 162.243.188.66.2328: Flags [P.], seq 198368:198976, ack 1, win 502, options [nop,nop,TS val 1107907226 ecr 4160163515], length 608
06:56:05.235672 IP ubuntu-s-1vcpu-1gb-tor1-01.ssh > 162.243.188.66.2328: Flags [P.], seq 198976:199920, ack 1, win 502, options [nop,nop,TS val 1107907226 ecr 4160163515], length 944
06:56:05.235781 IP ubuntu-s-1vcpu-1gb-tor1-01.ssh > 162.243.188.66.2328: Flags [P.], seq 199920:199984, ack 1, win 502, options [nop,nop,TS val 1107907226 ecr 4160163515], length 64
06:56:05.250138 IP 162.243.188.66.2328 > ubuntu-s-1vcpu-1gb-tor1-01.ssh: Flags [.], ack 199920, win 4183, options [nop,nop,TS val 4160163607 ecr 1107907226], length 0
06:56:05.267273 IP 162.243.188.66.2328 > ubuntu-s-1vcpu-1gb-tor1-01.ssh: Flags [.], ack 199984, win 4193, options [nop,nop,TS val 4160163624 ecr 1107907226], length 0
06:56:05.339307 IP ubuntu-s-1vcpu-1gb-tor1-01.ssh > 162.243.188.66.2328: Flags [P.], seq 199984:200224, ack 1, win 502, options [nop,nop,TS val 1107907330 ecr 4160163624], length 240
06:56:05.339475 IP ubuntu-s-1vcpu-1gb-tor1-01.ssh > 162.243.188.66.2328: Flags [P.], seq 200224:201008, ack 1, win 502, options [nop,nop,TS val 1107907330 ecr 4160163624], length 784
06:56:05.339562 IP ubuntu-s-1vcpu-1gb-tor1-01.ssh > 162.243.188.66.2328: Flags [P.], seq 201008:201232, ack 1, win 502, options [nop,nop,TS val 1107907330 ecr 4160163624], length 224
06:56:05.362778 IP 162.243.188.66.2328 > ubuntu-s-1vcpu-1gb-tor1-01.ssh: Flags [.], ack 201232, win 4193, options [nop,nop,TS val 4160163720 ecr 1107907330], length 0
^C
839 packets captured
847 packets received by filter
0 packets dropped by kernel