root@ubuntu-s-1vcpu-1gb-tor1-01:~# tcpdump -i eth0 tcp

tcpdump: verbose output suppressed, use -v[v]... for full protocol decode
listening on eth0, link-type EN10MB (Ethernet), snapshot length 262144 bytes
07:10:41.165621 IP ubuntu-s-1vcpu-1gb-tor1-01.ssh > 162.243.188.66.14571: Flags [P.], seq 3866084313:3866084441, ack 18395949, win 502, options [nop,nop,TS val 1108783156 ecr 3260137364], length 128
07:10:41.165716 IP ubuntu-s-1vcpu-1gb-tor1-01.ssh > 162.243.188.66.14571: Flags [P.], seq 128:272, ack 1, win 502, options [nop,nop,TS val 1108783156 ecr 3260137364], length 144
07:10:41.165777 IP ubuntu-s-1vcpu-1gb-tor1-01.ssh > 162.243.188.66.14571: Flags [P.], seq 272:432, ack 1, win 502, options [nop,nop,TS val 1108783156 ecr 3260137364], length 160
07:10:41.165981 IP ubuntu-s-1vcpu-1gb-tor1-01.ssh > 162.243.188.66.14571: Flags [P.], seq 432:496, ack 1, win 502, options [nop,nop,TS val 1108783156 ecr 3260137364], length 64
07:10:41.174206 IP 162.243.188.66.14571 > ubuntu-s-1vcpu-1gb-tor1-01.ssh: Flags [.], ack 0, win 501, options [nop,nop,TS val 3260137383 ecr 1108783150], length 0
07:10:41.180073 IP 162.243.188.66.14571 > ubuntu-s-1vcpu-1gb-tor1-01.ssh: Flags [.], ack 128, win 501, options [nop,nop,TS val 3260137389 ecr 1108783156], length 0
07:10:41.180105 IP 162.243.188.66.14571 > ubuntu-s-1vcpu-1gb-tor1-01.ssh: Flags [.], ack 272, win 501, options [nop,nop,TS val 3260137389 ecr 1108783156], length 0
07:10:41.180276 IP 162.243.188.66.14571 > ubuntu-s-1vcpu-1gb-tor1-01.ssh: Flags [.], ack 432, win 501, options [nop,nop,TS val 3260137389 ecr 1108783156], length 0
07:10:41.180350 IP 162.243.188.66.14571 > ubuntu-s-1vcpu-1gb-tor1-01.ssh: Flags [.], ack 496, win 501, options [nop,nop,TS val 3260137390 ecr 1108783156], length 0
07:10:41.260073 IP ubuntu-s-1vcpu-1gb-tor1-01.57124 > 67.207.67.2.domain: Flags [S], seq 1974720695, win 64240, options [mss 1460,sackOK,TS val 980320503 ecr 0,nop,wscale 7,tfo  cookiereq,nop,nop], length 0
07:10:41.261507 IP 67.207.67.2.domain > ubuntu-s-1vcpu-1gb-tor1-01.57124: Flags [S.], seq 3543636593, ack 1974720696, win 65160, options [mss 1460,sackOK,TS val 2081002262 ecr 980320503,nop,wscale 9], length 0
07:10:41.261542 IP ubuntu-s-1vcpu-1gb-tor1-01.57124 > 67.207.67.2.domain: Flags [.], ack 1, win 502, options [nop,nop,TS val 980320504 ecr 2081002262], length 0
07:10:41.261584 IP ubuntu-s-1vcpu-1gb-tor1-01.57124 > 67.207.67.2.domain: Flags [P.], seq 1:48, ack 1, win 502, options [nop,nop,TS val 980320504 ecr 2081002262], length 47 9509+ PTR? 66.188.243.162.in-addr.arpa. (45)
07:10:41.261923 IP 67.207.67.2.domain > ubuntu-s-1vcpu-1gb-tor1-01.57124: Flags [.], ack 48, win 128, options [nop,nop,TS val 2081002263 ecr 980320504], length 0
07:10:41.262151 IP 67.207.67.2.domain > ubuntu-s-1vcpu-1gb-tor1-01.57124: Flags [P.], seq 1:115, ack 48, win 128, options [nop,nop,TS val 2081002263 ecr 980320504], length 114 9509 NXDomain 0/1/0 (112)
07:10:41.262175 IP ubuntu-s-1vcpu-1gb-tor1-01.57124 > 67.207.67.2.domain: Flags [.], ack 115, win 502, options [nop,nop,TS val 980320505 ecr 2081002263], length 0
07:10:41.263550 IP ubuntu-s-1vcpu-1gb-tor1-01.ssh > 162.243.188.66.14571: Flags [P.], seq 496:752, ack 1, win 502, options [nop,nop,TS val 1108783254 ecr 3260137390], length 256
07:10:41.263654 IP ubuntu-s-1vcpu-1gb-tor1-01.ssh > 162.243.188.66.14571: Flags [P.], seq 752:1056, ack 1, win 502, options [nop,nop,TS val 1108783254 ecr 3260137390], length 304
07:10:41.263694 IP ubuntu-s-1vcpu-1gb-tor1-01.ssh > 162.243.188.66.14571: Flags [P.], seq 1056:1120, ack 1, win 502, options [nop,nop,TS val 1108783254 ecr 3260137390], length 64
07:10:41.263931 IP ubuntu-s-1vcpu-1gb-tor1-01.ssh > 162.243.188.66.14571: Flags [P.], seq 1120:1360, ack 1, win 502, options [nop,nop,TS val 1108783254 ecr 3260137390], length 240
07:10:41.264009 IP ubuntu-s-1vcpu-1gb-tor1-01.ssh > 162.243.188.66.14571: Flags [P.], seq 1360:1664, ack 1, win 502, options [nop,nop,TS val 1108783254 ecr 3260137390], length 304
07:10:41.264074 IP ubuntu-s-1vcpu-1gb-tor1-01.ssh > 162.243.188.66.14571: Flags [P.], seq 1664:1952, ack 1, win 502, options [nop,nop,TS val 1108783255 ecr 3260137390], length 288
07:10:41.264136 IP ubuntu-s-1vcpu-1gb-tor1-01.ssh > 162.243.188.66.14571: Flags [P.], seq 1952:2240, ack 1, win 502, options [nop,nop,TS val 1108783255 ecr 3260137390], length 288
07:10:41.264197 IP ubuntu-s-1vcpu-1gb-tor1-01.ssh > 162.243.188.66.14571: Flags [P.], seq 2240:2592, ack 1, win 502, options [nop,nop,TS val 1108783255 ecr 3260137390], length 352
07:10:41.264257 IP ubuntu-s-1vcpu-1gb-tor1-01.ssh > 162.243.188.66.14571: Flags [P.], seq 2592:2880, ack 1, win 502, options [nop,nop,TS val 1108783255 ecr 3260137390], length 288
07:10:41.264318 IP ubuntu-s-1vcpu-1gb-tor1-01.ssh > 162.243.188.66.14571: Flags [P.], seq 2880:3168, ack 1, win 502, options [nop,nop,TS val 1108783255 ecr 3260137390], length 288
07:10:41.278131 IP 162.243.188.66.14571 > ubuntu-s-1vcpu-1gb-tor1-01.ssh: Flags [.], ack 752, win 501, options [nop,nop,TS val 3260137487 ecr 1108783254], length 0
07:10:41.278132 IP 162.243.188.66.14571 > ubuntu-s-1vcpu-1gb-tor1-01.ssh: Flags [.], ack 1056, win 501, options [nop,nop,TS val 3260137487 ecr 1108783254], length 0
07:10:41.278181 IP 162.243.188.66.14571 > ubuntu-s-1vcpu-1gb-tor1-01.ssh: Flags [.], ack 1120, win 501, options [nop,nop,TS val 3260137487 ecr 1108783254], length 0
07:10:41.278239 IP 162.243.188.66.14571 > ubuntu-s-1vcpu-1gb-tor1-01.ssh: Flags [.], ack 1360, win 500, options [nop,nop,TS val 3260137487 ecr 1108783254], length 0
07:10:41.278388 IP 162.243.188.66.14571 > ubuntu-s-1vcpu-1gb-tor1-01.ssh: Flags [.], ack 1664, win 498, options [nop,nop,TS val 3260137487 ecr 1108783254], length 0
07:10:41.278472 IP 162.243.188.66.14571 > ubuntu-s-1vcpu-1gb-tor1-01.ssh: Flags [.], ack 1952, win 496, options [nop,nop,TS val 3260137488 ecr 1108783255], length 0
07:10:41.278472 IP 162.243.188.66.14571 > ubuntu-s-1vcpu-1gb-tor1-01.ssh: Flags [.], ack 2240, win 494, options [nop,nop,TS val 3260137488 ecr 1108783255], length 0
07:10:41.278570 IP 162.243.188.66.14571 > ubuntu-s-1vcpu-1gb-tor1-01.ssh: Flags [.], ack 2592, win 492, options [nop,nop,TS val 3260137488 ecr 1108783255], length 0
07:10:41.278570 IP 162.243.188.66.14571 > ubuntu-s-1vcpu-1gb-tor1-01.ssh: Flags [.], ack 2880, win 490, options [nop,nop,TS val 3260137488 ecr 1108783255], length 0
07:10:41.278726 IP 162.243.188.66.14571 > ubuntu-s-1vcpu-1gb-tor1-01.ssh: Flags [.], ack 3168, win 488, options [nop,nop,TS val 3260137488 ecr 1108783255], length 0
07:10:41.363812 IP ubuntu-s-1vcpu-1gb-tor1-01.57124 > 67.207.67.2.domain: Flags [P.], seq 48:92, ack 115, win 502, options [nop,nop,TS val 980320606 ecr 2081002263], length 44 52646+ PTR? 2.67.207.67.in-addr.arpa. (42)
07:10:41.364353 IP 67.207.67.2.domain > ubuntu-s-1vcpu-1gb-tor1-01.57124: Flags [P.], seq 115:226, ack 92, win 128, options [nop,nop,TS val 2081002366 ecr 980320606], length 111 52646 NXDomain 0/1/0 (109)
07:10:41.364373 IP ubuntu-s-1vcpu-1gb-tor1-01.57124 > 67.207.67.2.domain: Flags [.], ack 226, win 502, options [nop,nop,TS val 980320607 ecr 2081002366], length 0
07:10:41.365116 IP ubuntu-s-1vcpu-1gb-tor1-01.ssh > 162.243.188.66.14571: Flags [P.], seq 3168:3424, ack 1, win 502, options [nop,nop,TS val 1108783356 ecr 3260137488], length 256
^C07:10:41.365335 IP 180.101.88.249.28285 > ubuntu-s-1vcpu-1gb-tor1-01.ssh: Flags [P.], seq 3001272370:3001272466, ack 4099021088, win 263, options [nop,nop,TS val 3071220 ecr 2701356422], length 96

41 packets captured
95 packets received by filter
9 packets dropped by kernel