root@ubuntu-s-1vcpu-1gb-tor1-01:~# tcpdump -n -i eth0

tcpdump: verbose output suppressed, use -v[v]... for full protocol decode
listening on eth0, link-type EN10MB (Ethernet), snapshot length 262144 bytes
07:09:38.472902 IP 159.203.10.106.22 > 162.243.188.66.14571: Flags [P.], seq 3866012697:3866012825, ack 18394957, win 502, options [nop,nop,TS val 1108720463 ecr 3260074667], length 128
07:09:38.472973 IP 159.203.10.106.22 > 162.243.188.66.14571: Flags [P.], seq 128:272, ack 1, win 502, options [nop,nop,TS val 1108720463 ecr 3260074667], length 144
07:09:38.473047 IP 159.203.10.106.22 > 162.243.188.66.14571: Flags [P.], seq 272:496, ack 1, win 502, options [nop,nop,TS val 1108720464 ecr 3260074667], length 224
07:09:38.473803 IP 162.243.188.66.14571 > 159.203.10.106.22: Flags [.], ack 0, win 501, options [nop,nop,TS val 3260074683 ecr 1108720450], length 0
07:09:38.487458 IP 162.243.188.66.14571 > 159.203.10.106.22: Flags [.], ack 128, win 501, options [nop,nop,TS val 3260074696 ecr 1108720463], length 0
07:09:38.487458 IP 162.243.188.66.14571 > 159.203.10.106.22: Flags [.], ack 272, win 501, options [nop,nop,TS val 3260074696 ecr 1108720463], length 0
07:09:38.487458 IP 162.243.188.66.14571 > 159.203.10.106.22: Flags [.], ack 496, win 501, options [nop,nop,TS val 3260074696 ecr 1108720464], length 0
07:09:38.563420 IP 159.203.10.106.22 > 162.243.188.66.14571: Flags [P.], seq 496:736, ack 1, win 502, options [nop,nop,TS val 1108720554 ecr 3260074696], length 240
07:09:38.563509 IP 159.203.10.106.22 > 162.243.188.66.14571: Flags [P.], seq 736:1024, ack 1, win 502, options [nop,nop,TS val 1108720554 ecr 3260074696], length 288
07:09:38.563541 IP 159.203.10.106.22 > 162.243.188.66.14571: Flags [P.], seq 1024:1088, ack 1, win 502, options [nop,nop,TS val 1108720554 ecr 3260074696], length 64
07:09:38.563595 IP 159.203.10.106.22 > 162.243.188.66.14571: Flags [P.], seq 1088:1376, ack 1, win 502, options [nop,nop,TS val 1108720554 ecr 3260074696], length 288
07:09:38.563656 IP 159.203.10.106.22 > 162.243.188.66.14571: Flags [P.], seq 1376:1648, ack 1, win 502, options [nop,nop,TS val 1108720554 ecr 3260074696], length 272
07:09:38.563715 IP 159.203.10.106.22 > 162.243.188.66.14571: Flags [P.], seq 1648:1920, ack 1, win 502, options [nop,nop,TS val 1108720554 ecr 3260074696], length 272
07:09:38.563778 IP 159.203.10.106.22 > 162.243.188.66.14571: Flags [P.], seq 1920:2400, ack 1, win 502, options [nop,nop,TS val 1108720554 ecr 3260074696], length 480
07:09:38.563855 IP 159.203.10.106.22 > 162.243.188.66.14571: Flags [P.], seq 2400:2464, ack 1, win 502, options [nop,nop,TS val 1108720554 ecr 3260074696], length 64
07:09:38.578073 IP 162.243.188.66.14571 > 159.203.10.106.22: Flags [.], ack 736, win 501, options [nop,nop,TS val 3260074787 ecr 1108720554], length 0
07:09:38.578073 IP 162.243.188.66.14571 > 159.203.10.106.22: Flags [.], ack 1024, win 501, options [nop,nop,TS val 3260074787 ecr 1108720554], length 0
07:09:38.578073 IP 162.243.188.66.14571 > 159.203.10.106.22: Flags [.], ack 1088, win 501, options [nop,nop,TS val 3260074787 ecr 1108720554], length 0
07:09:38.578073 IP 162.243.188.66.14571 > 159.203.10.106.22: Flags [.], ack 1376, win 500, options [nop,nop,TS val 3260074787 ecr 1108720554], length 0
07:09:38.578156 IP 162.243.188.66.14571 > 159.203.10.106.22: Flags [.], ack 1648, win 498, options [nop,nop,TS val 3260074787 ecr 1108720554], length 0
07:09:38.578156 IP 162.243.188.66.14571 > 159.203.10.106.22: Flags [.], ack 1920, win 496, options [nop,nop,TS val 3260074787 ecr 1108720554], length 0
07:09:38.578318 IP 162.243.188.66.14571 > 159.203.10.106.22: Flags [.], ack 2400, win 493, options [nop,nop,TS val 3260074787 ecr 1108720554], length 0
07:09:38.578444 IP 162.243.188.66.14571 > 159.203.10.106.22: Flags [.], ack 2464, win 493, options [nop,nop,TS val 3260074787 ecr 1108720554], length 0
07:09:38.667626 IP 159.203.10.106.22 > 162.243.188.66.14571: Flags [P.], seq 2464:2688, ack 1, win 502, options [nop,nop,TS val 1108720658 ecr 3260074787], length 224
07:09:38.667797 IP 159.203.10.106.22 > 162.243.188.66.14571: Flags [P.], seq 2688:2752, ack 1, win 502, options [nop,nop,TS val 1108720658 ecr 3260074787], length 64
07:09:38.667818 IP 159.203.10.106.22 > 162.243.188.66.14571: Flags [P.], seq 2752:2976, ack 1, win 502, options [nop,nop,TS val 1108720658 ecr 3260074787], length 224
07:09:38.667879 IP 159.203.10.106.22 > 162.243.188.66.14571: Flags [P.], seq 2976:3040, ack 1, win 502, options [nop,nop,TS val 1108720658 ecr 3260074787], length 64
07:09:38.667939 IP 159.203.10.106.22 > 162.243.188.66.14571: Flags [P.], seq 3040:3328, ack 1, win 502, options [nop,nop,TS val 1108720658 ecr 3260074787], length 288
07:09:38.668000 IP 159.203.10.106.22 > 162.243.188.66.14571: Flags [P.], seq 3328:3552, ack 1, win 502, options [nop,nop,TS val 1108720658 ecr 3260074787], length 224
07:09:38.668069 IP 159.203.10.106.22 > 162.243.188.66.14571: Flags [P.], seq 3552:3616, ack 1, win 502, options [nop,nop,TS val 1108720659 ecr 3260074787], length 64
07:09:38.668130 IP 159.203.10.106.22 > 162.243.188.66.14571: Flags [P.], seq 3616:3904, ack 1, win 502, options [nop,nop,TS val 1108720659 ecr 3260074787], length 288
07:09:38.668258 IP 159.203.10.106.22 > 162.243.188.66.14571: Flags [P.], seq 3904:4192, ack 1, win 502, options [nop,nop,TS val 1108720659 ecr 3260074787], length 288
07:09:38.668351 IP 159.203.10.106.22 > 162.243.188.66.14571: Flags [P.], seq 4192:4480, ack 1, win 502, options [nop,nop,TS val 1108720659 ecr 3260074787], length 288
07:09:38.668431 IP 159.203.10.106.22 > 162.243.188.66.14571: Flags [P.], seq 4480:4704, ack 1, win 502, options [nop,nop,TS val 1108720659 ecr 3260074787], length 224
07:09:38.668515 IP 159.203.10.106.22 > 162.243.188.66.14571: Flags [P.], seq 4704:4976, ack 1, win 502, options [nop,nop,TS val 1108720659 ecr 3260074787], length 272
07:09:38.668605 IP 159.203.10.106.22 > 162.243.188.66.14571: Flags [P.], seq 4976:5040, ack 1, win 502, options [nop,nop,TS val 1108720659 ecr 3260074787], length 64
07:09:38.668636 IP 159.203.10.106.22 > 162.243.188.66.14571: Flags [P.], seq 5040:5248, ack 1, win 502, options [nop,nop,TS val 1108720659 ecr 3260074787], length 208
07:09:38.668690 IP 159.203.10.106.22 > 162.243.188.66.14571: Flags [P.], seq 5248:5312, ack 1, win 502, options [nop,nop,TS val 1108720659 ecr 3260074787], length 64
07:09:38.668759 IP 159.203.10.106.22 > 162.243.188.66.14571: Flags [P.], seq 5312:5520, ack 1, win 502, options [nop,nop,TS val 1108720659 ecr 3260074787], length 208
07:09:38.682177 IP 162.243.188.66.14571 > 159.203.10.106.22: Flags [.], ack 2688, win 501, options [nop,nop,TS val 3260074891 ecr 1108720658], length 0
07:09:38.682234 IP 159.203.10.106.22 > 162.243.188.66.14571: Flags [P.], seq 5520:6944, ack 1, win 502, options [nop,nop,TS val 1108720673 ecr 3260074891], length 1424
07:09:38.682262 IP 162.243.188.66.14571 > 159.203.10.106.22: Flags [.], ack 2752, win 501, options [nop,nop,TS val 3260074891 ecr 1108720658], length 0
07:09:38.682262 IP 162.243.188.66.14571 > 159.203.10.106.22: Flags [.], ack 2976, win 501, options [nop,nop,TS val 3260074891 ecr 1108720658], length 0
07:09:38.682262 IP 162.243.188.66.14571 > 159.203.10.106.22: Flags [.], ack 3040, win 501, options [nop,nop,TS val 3260074891 ecr 1108720658], length 0
07:09:38.682769 IP 162.243.188.66.14571 > 159.203.10.106.22: Flags [.], ack 4704, win 488, options [nop,nop,TS val 3260074892 ecr 1108720658], length 0
07:09:38.696714 IP 162.243.188.66.14571 > 159.203.10.106.22: Flags [.], ack 6944, win 471, options [nop,nop,TS val 3260074906 ecr 1108720659], length 0
07:09:38.771338 IP 159.203.10.106.22 > 162.243.188.66.14571: Flags [P.], seq 6944:7168, ack 1, win 502, options [nop,nop,TS val 1108720762 ecr 3260074906], length 224
07:09:38.771422 IP 159.203.10.106.22 > 162.243.188.66.14571: Flags [P.], seq 7168:7456, ack 1, win 502, options [nop,nop,TS val 1108720762 ecr 3260074906], length 288
07:09:38.771481 IP 159.203.10.106.22 > 162.243.188.66.14571: Flags [P.], seq 7456:7520, ack 1, win 502, options [nop,nop,TS val 1108720762 ecr 3260074906], length 64
07:09:38.771538 IP 159.203.10.106.22 > 162.243.188.66.14571: Flags [P.], seq 7520:8032, ack 1, win 502, options [nop,nop,TS val 1108720762 ecr 3260074906], length 512
07:09:38.771596 IP 159.203.10.106.22 > 162.243.188.66.14571: Flags [P.], seq 8032:8320, ack 1, win 502, options [nop,nop,TS val 1108720762 ecr 3260074906], length 288
07:09:38.771654 IP 159.203.10.106.22 > 162.243.188.66.14571: Flags [P.], seq 8320:8672, ack 1, win 502, options [nop,nop,TS val 1108720762 ecr 3260074906], length 352
07:09:38.771714 IP 159.203.10.106.22 > 162.243.188.66.14571: Flags [P.], seq 8672:8960, ack 1, win 502, options [nop,nop,TS val 1108720762 ecr 3260074906], length 288
07:09:38.771774 IP 159.203.10.106.22 > 162.243.188.66.14571: Flags [P.], seq 8960:9248, ack 1, win 502, options [nop,nop,TS val 1108720762 ecr 3260074906], length 288
07:09:38.771831 IP 159.203.10.106.22 > 162.243.188.66.14571: Flags [P.], seq 9248:9536, ack 1, win 502, options [nop,nop,TS val 1108720762 ecr 3260074906], length 288
07:09:38.771890 IP 159.203.10.106.22 > 162.243.188.66.14571: Flags [P.], seq 9536:9824, ack 1, win 502, options [nop,nop,TS val 1108720762 ecr 3260074906], length 288
07:09:38.771948 IP 159.203.10.106.22 > 162.243.188.66.14571: Flags [P.], seq 9824:10112, ack 1, win 502, options [nop,nop,TS val 1108720762 ecr 3260074906], length 288
07:09:38.772007 IP 159.203.10.106.22 > 162.243.188.66.14571: Flags [P.], seq 10112:10624, ack 1, win 502, options [nop,nop,TS val 1108720762 ecr 3260074906], length 512
07:09:38.772066 IP 159.203.10.106.22 > 162.243.188.66.14571: Flags [P.], seq 10624:10912, ack 1, win 502, options [nop,nop,TS val 1108720763 ecr 3260074906], length 288
07:09:38.772124 IP 159.203.10.106.22 > 162.243.188.66.14571: Flags [P.], seq 10912:11264, ack 1, win 502, options [nop,nop,TS val 1108720763 ecr 3260074906], length 352
07:09:38.772184 IP 159.203.10.106.22 > 162.243.188.66.14571: Flags [P.], seq 11264:11552, ack 1, win 502, options [nop,nop,TS val 1108720763 ecr 3260074906], length 288
07:09:38.772242 IP 159.203.10.106.22 > 162.243.188.66.14571: Flags [P.], seq 11552:11824, ack 1, win 502, options [nop,nop,TS val 1108720763 ecr 3260074906], length 272
07:09:38.772302 IP 159.203.10.106.22 > 162.243.188.66.14571: Flags [P.], seq 11824:12320, ack 1, win 502, options [nop,nop,TS val 1108720763 ecr 3260074906], length 496
07:09:38.772360 IP 159.203.10.106.22 > 162.243.188.66.14571: Flags [P.], seq 12320:12384, ack 1, win 502, options [nop,nop,TS val 1108720763 ecr 3260074906], length 64
07:09:38.772419 IP 159.203.10.106.22 > 162.243.188.66.14571: Flags [P.], seq 12384:12656, ack 1, win 502, options [nop,nop,TS val 1108720763 ecr 3260074906], length 272
07:09:38.772478 IP 159.203.10.106.22 > 162.243.188.66.14571: Flags [P.], seq 12656:12864, ack 1, win 502, options [nop,nop,TS val 1108720763 ecr 3260074906], length 208
07:09:38.772538 IP 159.203.10.106.22 > 162.243.188.66.14571: Flags [P.], seq 12864:12928, ack 1, win 502, options [nop,nop,TS val 1108720763 ecr 3260074906], length 64
07:09:38.772597 IP 159.203.10.106.22 > 162.243.188.66.14571: Flags [P.], seq 12928:13200, ack 1, win 502, options [nop,nop,TS val 1108720763 ecr 3260074906], length 272
07:09:38.772666 IP 159.203.10.106.22 > 162.243.188.66.14571: Flags [P.], seq 13200:13472, ack 1, win 502, options [nop,nop,TS val 1108720763 ecr 3260074906], length 272
07:09:38.786266 IP 162.243.188.66.14571 > 159.203.10.106.22: Flags [.], ack 8672, win 493, options [nop,nop,TS val 3260074995 ecr 1108720762], length 0
07:09:38.786786 IP 162.243.188.66.14571 > 159.203.10.106.22: Flags [.], ack 10624, win 478, options [nop,nop,TS val 3260074996 ecr 1108720762], length 0
07:09:38.786980 IP 162.243.188.66.14571 > 159.203.10.106.22: Flags [.], ack 12320, win 465, options [nop,nop,TS val 3260074996 ecr 1108720763], length 0
07:09:38.829029 IP 162.243.188.66.14571 > 159.203.10.106.22: Flags [.], ack 13472, win 456, options [nop,nop,TS val 3260075038 ecr 1108720763], length 0
07:09:38.875372 IP 159.203.10.106.22 > 162.243.188.66.14571: Flags [P.], seq 13472:13696, ack 1, win 502, options [nop,nop,TS val 1108720866 ecr 3260075038], length 224
07:09:38.875489 IP 159.203.10.106.22 > 162.243.188.66.14571: Flags [P.], seq 13696:13984, ack 1, win 502, options [nop,nop,TS val 1108720866 ecr 3260075038], length 288
07:09:38.875532 IP 159.203.10.106.22 > 162.243.188.66.14571: Flags [P.], seq 13984:14048, ack 1, win 502, options [nop,nop,TS val 1108720866 ecr 3260075038], length 64
07:09:38.875591 IP 159.203.10.106.22 > 162.243.188.66.14571: Flags [P.], seq 14048:14272, ack 1, win 502, options [nop,nop,TS val 1108720866 ecr 3260075038], length 224
07:09:38.875649 IP 159.203.10.106.22 > 162.243.188.66.14571: Flags [P.], seq 14272:14336, ack 1, win 502, options [nop,nop,TS val 1108720866 ecr 3260075038], length 64
07:09:38.875705 IP 159.203.10.106.22 > 162.243.188.66.14571: Flags [P.], seq 14336:14624, ack 1, win 502, options [nop,nop,TS val 1108720866 ecr 3260075038], length 288
07:09:38.875766 IP 159.203.10.106.22 > 162.243.188.66.14571: Flags [P.], seq 14624:14848, ack 1, win 502, options [nop,nop,TS val 1108720866 ecr 3260075038], length 224
07:09:38.875825 IP 159.203.10.106.22 > 162.243.188.66.14571: Flags [P.], seq 14848:15136, ack 1, win 502, options [nop,nop,TS val 1108720866 ecr 3260075038], length 288
07:09:38.875884 IP 159.203.10.106.22 > 162.243.188.66.14571: Flags [P.], seq 15136:15200, ack 1, win 502, options [nop,nop,TS val 1108720866 ecr 3260075038], length 64
07:09:38.875944 IP 159.203.10.106.22 > 162.243.188.66.14571: Flags [P.], seq 15200:15488, ack 1, win 502, options [nop,nop,TS val 1108720866 ecr 3260075038], length 288
07:09:38.876002 IP 159.203.10.106.22 > 162.243.188.66.14571: Flags [P.], seq 15488:15712, ack 1, win 502, options [nop,nop,TS val 1108720866 ecr 3260075038], length 224
07:09:38.876064 IP 159.203.10.106.22 > 162.243.188.66.14571: Flags [P.], seq 15712:15776, ack 1, win 502, options [nop,nop,TS val 1108720867 ecr 3260075038], length 64
07:09:38.876129 IP 159.203.10.106.22 > 162.243.188.66.14571: Flags [P.], seq 15776:16064, ack 1, win 502, options [nop,nop,TS val 1108720867 ecr 3260075038], length 288
07:09:38.876188 IP 159.203.10.106.22 > 162.243.188.66.14571: Flags [P.], seq 16064:16352, ack 1, win 502, options [nop,nop,TS val 1108720867 ecr 3260075038], length 288
07:09:38.876256 IP 159.203.10.106.22 > 162.243.188.66.14571: Flags [P.], seq 16352:16576, ack 1, win 502, options [nop,nop,TS val 1108720867 ecr 3260075038], length 224
07:09:38.876317 IP 159.203.10.106.22 > 162.243.188.66.14571: Flags [P.], seq 16576:16864, ack 1, win 502, options [nop,nop,TS val 1108720867 ecr 3260075038], length 288
07:09:38.876374 IP 159.203.10.106.22 > 162.243.188.66.14571: Flags [P.], seq 16864:16928, ack 1, win 502, options [nop,nop,TS val 1108720867 ecr 3260075038], length 64
07:09:38.876434 IP 159.203.10.106.22 > 162.243.188.66.14571: Flags [P.], seq 16928:17216, ack 1, win 502, options [nop,nop,TS val 1108720867 ecr 3260075038], length 288
07:09:38.876491 IP 159.203.10.106.22 > 162.243.188.66.14571: Flags [P.], seq 17216:17440, ack 1, win 502, options [nop,nop,TS val 1108720867 ecr 3260075038], length 224
07:09:38.876550 IP 159.203.10.106.22 > 162.243.188.66.14571: Flags [P.], seq 17440:17728, ack 1, win 502, options [nop,nop,TS val 1108720867 ecr 3260075038], length 288
07:09:38.876619 IP 159.203.10.106.22 > 162.243.188.66.14571: Flags [P.], seq 17728:17792, ack 1, win 502, options [nop,nop,TS val 1108720867 ecr 3260075038], length 64
07:09:38.876679 IP 159.203.10.106.22 > 162.243.188.66.14571: Flags [P.], seq 17792:18080, ack 1, win 502, options [nop,nop,TS val 1108720867 ecr 3260075038], length 288
07:09:38.876746 IP 159.203.10.106.22 > 162.243.188.66.14571: Flags [P.], seq 18080:18368, ack 1, win 502, options [nop,nop,TS val 1108720867 ecr 3260075038], length 288
07:09:38.876804 IP 159.203.10.106.22 > 162.243.188.66.14571: Flags [P.], seq 18368:18592, ack 1, win 502, options [nop,nop,TS val 1108720867 ecr 3260075038], length 224
07:09:38.876862 IP 159.203.10.106.22 > 162.243.188.66.14571: Flags [P.], seq 18592:18880, ack 1, win 502, options [nop,nop,TS val 1108720867 ecr 3260075038], length 288
07:09:38.876922 IP 159.203.10.106.22 > 162.243.188.66.14571: Flags [P.], seq 18880:18944, ack 1, win 502, options [nop,nop,TS val 1108720867 ecr 3260075038], length 64
07:09:38.876991 IP 159.203.10.106.22 > 162.243.188.66.14571: Flags [P.], seq 18944:19232, ack 1, win 502, options [nop,nop,TS val 1108720867 ecr 3260075038], length 288
07:09:38.877050 IP 159.203.10.106.22 > 162.243.188.66.14571: Flags [P.], seq 19232:19520, ack 1, win 502, options [nop,nop,TS val 1108720868 ecr 3260075038], length 288
07:09:38.877109 IP 159.203.10.106.22 > 162.243.188.66.14571: Flags [P.], seq 19520:19744, ack 1, win 502, options [nop,nop,TS val 1108720868 ecr 3260075038], length 224
07:09:38.877173 IP 159.203.10.106.22 > 162.243.188.66.14571: Flags [P.], seq 19744:20032, ack 1, win 502, options [nop,nop,TS val 1108720868 ecr 3260075038], length 288
07:09:38.877252 IP 159.203.10.106.22 > 162.243.188.66.14571: Flags [P.], seq 20032:20304, ack 1, win 502, options [nop,nop,TS val 1108720868 ecr 3260075038], length 272
07:09:38.877319 IP 159.203.10.106.22 > 162.243.188.66.14571: Flags [P.], seq 20304:20576, ack 1, win 502, options [nop,nop,TS val 1108720868 ecr 3260075038], length 272
07:09:38.877378 IP 159.203.10.106.22 > 162.243.188.66.14571: Flags [P.], seq 20576:20640, ack 1, win 502, options [nop,nop,TS val 1108720868 ecr 3260075038], length 64
07:09:38.877438 IP 159.203.10.106.22 > 162.243.188.66.14571: Flags [P.], seq 20640:20912, ack 1, win 502, options [nop,nop,TS val 1108720868 ecr 3260075038], length 272
07:09:38.877496 IP 159.203.10.106.22 > 162.243.188.66.14571: Flags [P.], seq 20912:21184, ack 1, win 502, options [nop,nop,TS val 1108720868 ecr 3260075038], length 272
07:09:38.890305 IP 162.243.188.66.14571 > 159.203.10.106.22: Flags [.], ack 15136, win 490, options [nop,nop,TS val 3260075099 ecr 1108720866], length 0
07:09:38.890693 IP 162.243.188.66.14571 > 159.203.10.106.22: Flags [.], ack 16864, win 477, options [nop,nop,TS val 3260075100 ecr 1108720866], length 0
07:09:38.891155 IP 162.243.188.66.14571 > 159.203.10.106.22: Flags [.], ack 18368, win 466, options [nop,nop,TS val 3260075100 ecr 1108720867], length 0
07:09:38.891832 IP 162.243.188.66.14571 > 159.203.10.106.22: Flags [.], ack 20032, win 453, options [nop,nop,TS val 3260075101 ecr 1108720867], length 0
07:09:38.933090 IP 162.243.188.66.14571 > 159.203.10.106.22: Flags [.], ack 21184, win 463, options [nop,nop,TS val 3260075142 ecr 1108720868], length 0
07:09:38.979280 IP 159.203.10.106.22 > 162.243.188.66.14571: Flags [P.], seq 21184:21408, ack 1, win 502, options [nop,nop,TS val 1108720970 ecr 3260075142], length 224
07:09:38.979379 IP 159.203.10.106.22 > 162.243.188.66.14571: Flags [P.], seq 21408:21696, ack 1, win 502, options [nop,nop,TS val 1108720970 ecr 3260075142], length 288
07:09:38.979436 IP 159.203.10.106.22 > 162.243.188.66.14571: Flags [P.], seq 21696:21760, ack 1, win 502, options [nop,nop,TS val 1108720970 ecr 3260075142], length 64
07:09:38.979494 IP 159.203.10.106.22 > 162.243.188.66.14571: Flags [P.], seq 21760:21984, ack 1, win 502, options [nop,nop,TS val 1108720970 ecr 3260075142], length 224
07:09:38.979553 IP 159.203.10.106.22 > 162.243.188.66.14571: Flags [P.], seq 21984:22048, ack 1, win 502, options [nop,nop,TS val 1108720970 ecr 3260075142], length 64
07:09:38.979613 IP 159.203.10.106.22 > 162.243.188.66.14571: Flags [P.], seq 22048:22272, ack 1, win 502, options [nop,nop,TS val 1108720970 ecr 3260075142], length 224
07:09:38.979670 IP 159.203.10.106.22 > 162.243.188.66.14571: Flags [P.], seq 22272:22336, ack 1, win 502, options [nop,nop,TS val 1108720970 ecr 3260075142], length 64
07:09:38.979738 IP 159.203.10.106.22 > 162.243.188.66.14571: Flags [P.], seq 22336:22624, ack 1, win 502, options [nop,nop,TS val 1108720970 ecr 3260075142], length 288
07:09:38.979799 IP 159.203.10.106.22 > 162.243.188.66.14571: Flags [P.], seq 22624:22848, ack 1, win 502, options [nop,nop,TS val 1108720970 ecr 3260075142], length 224
07:09:38.979857 IP 159.203.10.106.22 > 162.243.188.66.14571: Flags [P.], seq 22848:22912, ack 1, win 502, options [nop,nop,TS val 1108720970 ecr 3260075142], length 64
07:09:38.979915 IP 159.203.10.106.22 > 162.243.188.66.14571: Flags [P.], seq 22912:23200, ack 1, win 502, options [nop,nop,TS val 1108720970 ecr 3260075142], length 288
07:09:38.979974 IP 159.203.10.106.22 > 162.243.188.66.14571: Flags [P.], seq 23200:23488, ack 1, win 502, options [nop,nop,TS val 1108720970 ecr 3260075142], length 288
07:09:38.980033 IP 159.203.10.106.22 > 162.243.188.66.14571: Flags [P.], seq 23488:23712, ack 1, win 502, options [nop,nop,TS val 1108720970 ecr 3260075142], length 224
07:09:38.980113 IP 159.203.10.106.22 > 162.243.188.66.14571: Flags [P.], seq 23712:24000, ack 1, win 502, options [nop,nop,TS val 1108720971 ecr 3260075142], length 288
07:09:38.980186 IP 159.203.10.106.22 > 162.243.188.66.14571: Flags [P.], seq 24000:24288, ack 1, win 502, options [nop,nop,TS val 1108720971 ecr 3260075142], length 288
07:09:38.980268 IP 159.203.10.106.22 > 162.243.188.66.14571: Flags [P.], seq 24288:24864, ack 1, win 502, options [nop,nop,TS val 1108720971 ecr 3260075142], length 576
07:09:38.980333 IP 159.203.10.106.22 > 162.243.188.66.14571: Flags [P.], seq 24864:25216, ack 1, win 502, options [nop,nop,TS val 1108720971 ecr 3260075142], length 352
07:09:38.980392 IP 159.203.10.106.22 > 162.243.188.66.14571: Flags [P.], seq 25216:25440, ack 1, win 502, options [nop,nop,TS val 1108720971 ecr 3260075142], length 224
07:09:38.980450 IP 159.203.10.106.22 > 162.243.188.66.14571: Flags [P.], seq 25440:25792, ack 1, win 502, options [nop,nop,TS val 1108720971 ecr 3260075142], length 352
07:09:38.980508 IP 159.203.10.106.22 > 162.243.188.66.14571: Flags [P.], seq 25792:26080, ack 1, win 502, options [nop,nop,TS val 1108720971 ecr 3260075142], length 288
07:09:38.980569 IP 159.203.10.106.22 > 162.243.188.66.14571: Flags [P.], seq 26080:26368, ack 1, win 502, options [nop,nop,TS val 1108720971 ecr 3260075142], length 288
07:09:38.980630 IP 159.203.10.106.22 > 162.243.188.66.14571: Flags [P.], seq 26368:26592, ack 1, win 502, options [nop,nop,TS val 1108720971 ecr 3260075142], length 224
07:09:38.980694 IP 159.203.10.106.22 > 162.243.188.66.14571: Flags [P.], seq 26592:26656, ack 1, win 502, options [nop,nop,TS val 1108720971 ecr 3260075142], length 64
07:09:38.980745 IP 159.203.10.106.22 > 162.243.188.66.14571: Flags [P.], seq 26656:26880, ack 1, win 502, options [nop,nop,TS val 1108720971 ecr 3260075142], length 224
07:09:38.980803 IP 159.203.10.106.22 > 162.243.188.66.14571: Flags [P.], seq 26880:26944, ack 1, win 502, options [nop,nop,TS val 1108720971 ecr 3260075142], length 64
07:09:38.980862 IP 159.203.10.106.22 > 162.243.188.66.14571: Flags [P.], seq 26944:27232, ack 1, win 502, options [nop,nop,TS val 1108720971 ecr 3260075142], length 288
07:09:38.980921 IP 159.203.10.106.22 > 162.243.188.66.14571: Flags [P.], seq 27232:27520, ack 1, win 502, options [nop,nop,TS val 1108720971 ecr 3260075142], length 288
07:09:38.980980 IP 159.203.10.106.22 > 162.243.188.66.14571: Flags [P.], seq 27520:27744, ack 1, win 502, options [nop,nop,TS val 1108720971 ecr 3260075142], length 224
07:09:38.981038 IP 159.203.10.106.22 > 162.243.188.66.14571: Flags [P.], seq 27744:28032, ack 1, win 502, options [nop,nop,TS val 1108720971 ecr 3260075142], length 288
07:09:38.981109 IP 159.203.10.106.22 > 162.243.188.66.14571: Flags [P.], seq 28032:28320, ack 1, win 502, options [nop,nop,TS val 1108720972 ecr 3260075142], length 288
07:09:38.981169 IP 159.203.10.106.22 > 162.243.188.66.14571: Flags [P.], seq 28320:28384, ack 1, win 502, options [nop,nop,TS val 1108720972 ecr 3260075142], length 64
07:09:38.981227 IP 159.203.10.106.22 > 162.243.188.66.14571: Flags [P.], seq 28384:28672, ack 1, win 502, options [nop,nop,TS val 1108720972 ecr 3260075142], length 288
07:09:38.981286 IP 159.203.10.106.22 > 162.243.188.66.14571: Flags [P.], seq 28672:28896, ack 1, win 502, options [nop,nop,TS val 1108720972 ecr 3260075142], length 224
07:09:38.981346 IP 159.203.10.106.22 > 162.243.188.66.14571: Flags [P.], seq 28896:29184, ack 1, win 502, options [nop,nop,TS val 1108720972 ecr 3260075142], length 288
07:09:38.981406 IP 159.203.10.106.22 > 162.243.188.66.14571: Flags [P.], seq 29184:29248, ack 1, win 502, options [nop,nop,TS val 1108720972 ecr 3260075142], length 64
07:09:38.981466 IP 159.203.10.106.22 > 162.243.188.66.14571: Flags [P.], seq 29248:29536, ack 1, win 502, options [nop,nop,TS val 1108720972 ecr 3260075142], length 288
07:09:38.981523 IP 159.203.10.106.22 > 162.243.188.66.14571: Flags [P.], seq 29536:29824, ack 1, win 502, options [nop,nop,TS val 1108720972 ecr 3260075142], length 288
07:09:38.981582 IP 159.203.10.106.22 > 162.243.188.66.14571: Flags [P.], seq 29824:30048, ack 1, win 502, options [nop,nop,TS val 1108720972 ecr 3260075142], length 224
07:09:38.981641 IP 159.203.10.106.22 > 162.243.188.66.14571: Flags [P.], seq 30048:30112, ack 1, win 502, options [nop,nop,TS val 1108720972 ecr 3260075142], length 64
07:09:38.981700 IP 159.203.10.106.22 > 162.243.188.66.14571: Flags [P.], seq 30112:30400, ack 1, win 502, options [nop,nop,TS val 1108720972 ecr 3260075142], length 288
07:09:38.981757 IP 159.203.10.106.22 > 162.243.188.66.14571: Flags [P.], seq 30400:30688, ack 1, win 502, options [nop,nop,TS val 1108720972 ecr 3260075142], length 288
07:09:38.982000 IP 159.203.10.106.22 > 162.243.188.66.14571: Flags [P.], seq 30688:30976, ack 1, win 502, options [nop,nop,TS val 1108720972 ecr 3260075142], length 288
07:09:38.982072 IP 159.203.10.106.22 > 162.243.188.66.14571: Flags [P.], seq 30976:31264, ack 1, win 502, options [nop,nop,TS val 1108720973 ecr 3260075142], length 288
07:09:38.982132 IP 159.203.10.106.22 > 162.243.188.66.14571: Flags [P.], seq 31264:31536, ack 1, win 502, options [nop,nop,TS val 1108720973 ecr 3260075142], length 272
07:09:38.982190 IP 159.203.10.106.22 > 162.243.188.66.14571: Flags [P.], seq 31536:31744, ack 1, win 502, options [nop,nop,TS val 1108720973 ecr 3260075142], length 208
07:09:38.982248 IP 159.203.10.106.22 > 162.243.188.66.14571: Flags [P.], seq 31744:32016, ack 1, win 502, options [nop,nop,TS val 1108720973 ecr 3260075142], length 272
07:09:38.982306 IP 159.203.10.106.22 > 162.243.188.66.14571: Flags [P.], seq 32016:32080, ack 1, win 502, options [nop,nop,TS val 1108720973 ecr 3260075142], length 64
07:09:38.982366 IP 159.203.10.106.22 > 162.243.188.66.14571: Flags [P.], seq 32080:32352, ack 1, win 502, options [nop,nop,TS val 1108720973 ecr 3260075142], length 272
07:09:38.982431 IP 159.203.10.106.22 > 162.243.188.66.14571: Flags [P.], seq 32352:32624, ack 1, win 502, options [nop,nop,TS val 1108720973 ecr 3260075142], length 272
07:09:38.994246 IP 162.243.188.66.14571 > 159.203.10.106.22: Flags [.], ack 22848, win 488, options [nop,nop,TS val 3260075203 ecr 1108720970], length 0
07:09:38.994686 IP 162.243.188.66.14571 > 159.203.10.106.22: Flags [.], ack 24864, win 473, options [nop,nop,TS val 3260075204 ecr 1108720970], length 0
07:09:38.994962 IP 162.243.188.66.14571 > 159.203.10.106.22: Flags [.], ack 26368, win 462, options [nop,nop,TS val 3260075204 ecr 1108720971], length 0
07:09:38.995618 IP 162.243.188.66.14571 > 159.203.10.106.22: Flags [.], ack 28032, win 449, options [nop,nop,TS val 3260075205 ecr 1108720971], length 0
07:09:38.995902 IP 162.243.188.66.14571 > 159.203.10.106.22: Flags [.], ack 29536, win 438, options [nop,nop,TS val 3260075205 ecr 1108720972], length 0
07:09:38.996459 IP 162.243.188.66.14571 > 159.203.10.106.22: Flags [.], ack 31264, win 425, options [nop,nop,TS val 3260075206 ecr 1108720972], length 0
07:09:39.041026 IP 162.243.188.66.14571 > 159.203.10.106.22: Flags [.], ack 32624, win 415, options [nop,nop,TS val 3260075250 ecr 1108720973], length 0
07:09:39.083300 IP 159.203.10.106.22 > 162.243.188.66.14571: Flags [P.], seq 32624:32848, ack 1, win 502, options [nop,nop,TS val 1108721074 ecr 3260075250], length 224
07:09:39.083386 IP 159.203.10.106.22 > 162.243.188.66.14571: Flags [P.], seq 32848:33136, ack 1, win 502, options [nop,nop,TS val 1108721074 ecr 3260075250], length 288
07:09:39.083438 IP 159.203.10.106.22 > 162.243.188.66.14571: Flags [P.], seq 33136:33200, ack 1, win 502, options [nop,nop,TS val 1108721074 ecr 3260075250], length 64
07:09:39.083513 IP 159.203.10.106.22 > 162.243.188.66.14571: Flags [P.], seq 33200:33712, ack 1, win 502, options [nop,nop,TS val 1108721074 ecr 3260075250], length 512
07:09:39.083576 IP 159.203.10.106.22 > 162.243.188.66.14571: Flags [P.], seq 33712:34064, ack 1, win 502, options [nop,nop,TS val 1108721074 ecr 3260075250], length 352
07:09:39.083648 IP 159.203.10.106.22 > 162.243.188.66.14571: Flags [P.], seq 34064:34576, ack 1, win 502, options [nop,nop,TS val 1108721074 ecr 3260075250], length 512
07:09:39.083711 IP 159.203.10.106.22 > 162.243.188.66.14571: Flags [P.], seq 34576:34864, ack 1, win 502, options [nop,nop,TS val 1108721074 ecr 3260075250], length 288
07:09:39.083772 IP 159.203.10.106.22 > 162.243.188.66.14571: Flags [P.], seq 34864:35216, ack 1, win 502, options [nop,nop,TS val 1108721074 ecr 3260075250], length 352
07:09:39.083834 IP 159.203.10.106.22 > 162.243.188.66.14571: Flags [P.], seq 35216:35504, ack 1, win 502, options [nop,nop,TS val 1108721074 ecr 3260075250], length 288
07:09:39.083896 IP 159.203.10.106.22 > 162.243.188.66.14571: Flags [P.], seq 35504:36016, ack 1, win 502, options [nop,nop,TS val 1108721074 ecr 3260075250], length 512
07:09:39.083961 IP 159.203.10.106.22 > 162.243.188.66.14571: Flags [P.], seq 36016:36368, ack 1, win 502, options [nop,nop,TS val 1108721074 ecr 3260075250], length 352
07:09:39.084027 IP 159.203.10.106.22 > 162.243.188.66.14571: Flags [P.], seq 36368:36656, ack 1, win 502, options [nop,nop,TS val 1108721074 ecr 3260075250], length 288
07:09:39.084101 IP 159.203.10.106.22 > 162.243.188.66.14571: Flags [P.], seq 36656:37168, ack 1, win 502, options [nop,nop,TS val 1108721075 ecr 3260075250], length 512
07:09:39.084164 IP 159.203.10.106.22 > 162.243.188.66.14571: Flags [P.], seq 37168:37456, ack 1, win 502, options [nop,nop,TS val 1108721075 ecr 3260075250], length 288
07:09:39.084225 IP 159.203.10.106.22 > 162.243.188.66.14571: Flags [P.], seq 37456:37808, ack 1, win 502, options [nop,nop,TS val 1108721075 ecr 3260075250], length 352
07:09:39.084284 IP 159.203.10.106.22 > 162.243.188.66.14571: Flags [P.], seq 37808:38096, ack 1, win 502, options [nop,nop,TS val 1108721075 ecr 3260075250], length 288
07:09:39.084343 IP 159.203.10.106.22 > 162.243.188.66.14571: Flags [P.], seq 38096:38384, ack 1, win 502, options [nop,nop,TS val 1108721075 ecr 3260075250], length 288
07:09:39.084403 IP 159.203.10.106.22 > 162.243.188.66.14571: Flags [P.], seq 38384:38672, ack 1, win 502, options [nop,nop,TS val 1108721075 ecr 3260075250], length 288
07:09:39.084464 IP 159.203.10.106.22 > 162.243.188.66.14571: Flags [P.], seq 38672:38960, ack 1, win 502, options [nop,nop,TS val 1108721075 ecr 3260075250], length 288
07:09:39.084524 IP 159.203.10.106.22 > 162.243.188.66.14571: Flags [P.], seq 38960:39184, ack 1, win 502, options [nop,nop,TS val 1108721075 ecr 3260075250], length 224
07:09:39.084583 IP 159.203.10.106.22 > 162.243.188.66.14571: Flags [P.], seq 39184:39472, ack 1, win 502, options [nop,nop,TS val 1108721075 ecr 3260075250], length 288
07:09:39.084642 IP 159.203.10.106.22 > 162.243.188.66.14571: Flags [P.], seq 39472:39536, ack 1, win 502, options [nop,nop,TS val 1108721075 ecr 3260075250], length 64
07:09:39.084701 IP 159.203.10.106.22 > 162.243.188.66.14571: Flags [P.], seq 39536:39824, ack 1, win 502, options [nop,nop,TS val 1108721075 ecr 3260075250], length 288
07:09:39.084761 IP 159.203.10.106.22 > 162.243.188.66.14571: Flags [P.], seq 39824:40112, ack 1, win 502, options [nop,nop,TS val 1108721075 ecr 3260075250], length 288
07:09:39.084821 IP 159.203.10.106.22 > 162.243.188.66.14571: Flags [P.], seq 40112:40336, ack 1, win 502, options [nop,nop,TS val 1108721075 ecr 3260075250], length 224
07:09:39.084880 IP 159.203.10.106.22 > 162.243.188.66.14571: Flags [P.], seq 40336:40688, ack 1, win 502, options [nop,nop,TS val 1108721075 ecr 3260075250], length 352
07:09:39.084941 IP 159.203.10.106.22 > 162.243.188.66.14571: Flags [P.], seq 40688:40976, ack 1, win 502, options [nop,nop,TS val 1108721075 ecr 3260075250], length 288
07:09:39.085000 IP 159.203.10.106.22 > 162.243.188.66.14571: Flags [P.], seq 40976:41264, ack 1, win 502, options [nop,nop,TS val 1108721075 ecr 3260075250], length 288
07:09:39.085062 IP 159.203.10.106.22 > 162.243.188.66.14571: Flags [P.], seq 41264:41712, ack 1, win 502, options [nop,nop,TS val 1108721076 ecr 3260075250], length 448
07:09:39.085128 IP 159.203.10.106.22 > 162.243.188.66.14571: Flags [P.], seq 41712:42336, ack 1, win 502, options [nop,nop,TS val 1108721076 ecr 3260075250], length 624
07:09:39.085187 IP 159.203.10.106.22 > 162.243.188.66.14571: Flags [P.], seq 42336:42736, ack 1, win 502, options [nop,nop,TS val 1108721076 ecr 3260075250], length 400
07:09:39.085247 IP 159.203.10.106.22 > 162.243.188.66.14571: Flags [P.], seq 42736:43184, ack 1, win 502, options [nop,nop,TS val 1108721076 ecr 3260075250], length 448
07:09:39.085308 IP 159.203.10.106.22 > 162.243.188.66.14571: Flags [P.], seq 43184:43408, ack 1, win 502, options [nop,nop,TS val 1108721076 ecr 3260075250], length 224
07:09:39.085369 IP 159.203.10.106.22 > 162.243.188.66.14571: Flags [P.], seq 43408:43632, ack 1, win 502, options [nop,nop,TS val 1108721076 ecr 3260075250], length 224
07:09:39.085488 IP 159.203.10.106.22 > 162.243.188.66.14571: Flags [P.], seq 43632:43856, ack 1, win 502, options [nop,nop,TS val 1108721076 ecr 3260075250], length 224
07:09:39.085558 IP 159.203.10.106.22 > 162.243.188.66.14571: Flags [P.], seq 43856:44256, ack 1, win 502, options [nop,nop,TS val 1108721076 ecr 3260075250], length 400
07:09:39.085700 IP 159.203.10.106.22 > 162.243.188.66.14571: Flags [P.], seq 44256:44656, ack 1, win 502, options [nop,nop,TS val 1108721076 ecr 3260075250], length 400
07:09:39.085979 IP 159.203.10.106.22 > 162.243.188.66.14571: Flags [P.], seq 44656:45056, ack 1, win 502, options [nop,nop,TS val 1108721076 ecr 3260075250], length 400
07:09:39.086296 IP 159.203.10.106.22 > 162.243.188.66.14571: Flags [P.], seq 45056:46368, ack 1, win 502, options [nop,nop,TS val 1108721077 ecr 3260075250], length 1312
07:09:39.098085 IP 162.243.188.66.14571 > 159.203.10.106.22: Flags [.], ack 34576, win 403, options [nop,nop,TS val 3260075307 ecr 1108721074], length 0
07:09:39.098454 IP 162.243.188.66.14571 > 159.203.10.106.22: Flags [.], ack 36368, win 389, options [nop,nop,TS val 3260075308 ecr 1108721074], length 0
07:09:39.098588 IP 162.243.188.66.14571 > 159.203.10.106.22: Flags [.], ack 38096, win 376, options [nop,nop,TS val 3260075308 ecr 1108721074], length 0
07:09:39.099057 IP 162.243.188.66.14571 > 159.203.10.106.22: Flags [.], ack 39824, win 363, options [nop,nop,TS val 3260075308 ecr 1108721075], length 0
07:09:39.099529 IP 162.243.188.66.14571 > 159.203.10.106.22: Flags [.], ack 41712, win 349, options [nop,nop,TS val 3260075309 ecr 1108721075], length 0
07:09:39.099678 IP 162.243.188.66.14571 > 159.203.10.106.22: Flags [.], ack 43184, win 338, options [nop,nop,TS val 3260075309 ecr 1108721076], length 0
07:09:39.100127 IP 162.243.188.66.14571 > 159.203.10.106.22: Flags [.], ack 44656, win 327, options [nop,nop,TS val 3260075309 ecr 1108721076], length 0
07:09:39.101379 IP 162.243.188.66.14571 > 159.203.10.106.22: Flags [.], ack 46368, win 314, options [nop,nop,TS val 3260075310 ecr 1108721076], length 0
07:09:39.187330 IP 159.203.10.106.22 > 162.243.188.66.14571: Flags [P.], seq 46368:47280, ack 1, win 502, options [nop,nop,TS val 1108721178 ecr 3260075310], length 912
07:09:39.187565 IP 159.203.10.106.22 > 162.243.188.66.14571: Flags [P.], seq 47280:49200, ack 1, win 502, options [nop,nop,TS val 1108721178 ecr 3260075310], length 1920
07:09:39.187690 IP 159.203.10.106.22 > 162.243.188.66.14571: Flags [P.], seq 49200:50272, ack 1, win 502, options [nop,nop,TS val 1108721178 ecr 3260075310], length 1072
07:09:39.187833 IP 159.203.10.106.22 > 162.243.188.66.14571: Flags [P.], seq 50272:51648, ack 1, win 502, options [nop,nop,TS val 1108721178 ecr 3260075310], length 1376
07:09:39.187916 IP 159.203.10.106.22 > 162.243.188.66.14571: Flags [P.], seq 51648:51872, ack 1, win 502, options [nop,nop,TS val 1108721178 ecr 3260075310], length 224
07:09:39.187925 IP 159.203.10.106.22 > 162.243.188.66.14571: Flags [P.], seq 51872:52272, ack 1, win 502, options [nop,nop,TS val 1108721178 ecr 3260075310], length 400
07:09:39.187986 IP 159.203.10.106.22 > 162.243.188.66.14571: Flags [P.], seq 52272:52672, ack 1, win 502, options [nop,nop,TS val 1108721178 ecr 3260075310], length 400
07:09:39.188068 IP 159.203.10.106.22 > 162.243.188.66.14571: Flags [P.], seq 52672:53408, ack 1, win 502, options [nop,nop,TS val 1108721179 ecr 3260075310], length 736
07:09:39.188168 IP 159.203.10.106.22 > 162.243.188.66.14571: Flags [P.], seq 53408:53792, ack 1, win 502, options [nop,nop,TS val 1108721179 ecr 3260075310], length 384
07:09:39.188236 IP 159.203.10.106.22 > 162.243.188.66.14571: Flags [P.], seq 53792:54208, ack 1, win 502, options [nop,nop,TS val 1108721179 ecr 3260075310], length 416
07:09:39.188322 IP 159.203.10.106.22 > 162.243.188.66.14571: Flags [P.], seq 54208:54576, ack 1, win 502, options [nop,nop,TS val 1108721179 ecr 3260075310], length 368
07:09:39.188400 IP 159.203.10.106.22 > 162.243.188.66.14571: Flags [P.], seq 54576:55088, ack 1, win 502, options [nop,nop,TS val 1108721179 ecr 3260075310], length 512
07:09:39.202039 IP 162.243.188.66.14571 > 159.203.10.106.22: Flags [.], ack 49200, win 438, options [nop,nop,TS val 3260075411 ecr 1108721178], length 0
07:09:39.202140 IP 162.243.188.66.14571 > 159.203.10.106.22: Flags [.], ack 51648, win 424, options [nop,nop,TS val 3260075411 ecr 1108721178], length 0
07:09:39.202353 IP 162.243.188.66.14571 > 159.203.10.106.22: Flags [.], ack 53408, win 411, options [nop,nop,TS val 3260075411 ecr 1108721178], length 0
07:09:39.202765 IP 162.243.188.66.14571 > 159.203.10.106.22: Flags [.], ack 55088, win 398, options [nop,nop,TS val 3260075412 ecr 1108721179], length 0
07:09:39.291297 IP 159.203.10.106.22 > 162.243.188.66.14571: Flags [P.], seq 55088:55312, ack 1, win 502, options [nop,nop,TS val 1108721282 ecr 3260075412], length 224
07:09:39.291414 IP 159.203.10.106.22 > 162.243.188.66.14571: Flags [P.], seq 55312:55712, ack 1, win 502, options [nop,nop,TS val 1108721282 ecr 3260075412], length 400
07:09:39.291489 IP 159.203.10.106.22 > 162.243.188.66.14571: Flags [P.], seq 55712:56288, ack 1, win 502, options [nop,nop,TS val 1108721282 ecr 3260075412], length 576
07:09:39.291572 IP 159.203.10.106.22 > 162.243.188.66.14571: Flags [P.], seq 56288:56912, ack 1, win 502, options [nop,nop,TS val 1108721282 ecr 3260075412], length 624
07:09:39.291653 IP 159.203.10.106.22 > 162.243.188.66.14571: Flags [P.], seq 56912:57472, ack 1, win 502, options [nop,nop,TS val 1108721282 ecr 3260075412], length 560
07:09:39.291725 IP 159.203.10.106.22 > 162.243.188.66.14571: Flags [P.], seq 57472:57888, ack 1, win 502, options [nop,nop,TS val 1108721282 ecr 3260075412], length 416
07:09:39.291799 IP 159.203.10.106.22 > 162.243.188.66.14571: Flags [P.], seq 57888:58304, ack 1, win 502, options [nop,nop,TS val 1108721282 ecr 3260075412], length 416
07:09:39.291880 IP 159.203.10.106.22 > 162.243.188.66.14571: Flags [P.], seq 58304:58368, ack 1, win 502, options [nop,nop,TS val 1108721282 ecr 3260075412], length 64
07:09:39.306202 IP 162.243.188.66.14571 > 159.203.10.106.22: Flags [.], ack 56912, win 497, options [nop,nop,TS val 3260075515 ecr 1108721282], length 0
07:09:39.306246 IP 162.243.188.66.14571 > 159.203.10.106.22: Flags [.], ack 58368, win 486, options [nop,nop,TS val 3260075515 ecr 1108721282], length 0
07:09:39.395317 IP 159.203.10.106.22 > 162.243.188.66.14571: Flags [P.], seq 58368:58592, ack 1, win 502, options [nop,nop,TS val 1108721386 ecr 3260075515], length 224
07:09:39.395405 IP 159.203.10.106.22 > 162.243.188.66.14571: Flags [P.], seq 58592:58880, ack 1, win 502, options [nop,nop,TS val 1108721386 ecr 3260075515], length 288
07:09:39.395481 IP 159.203.10.106.22 > 162.243.188.66.14571: Flags [P.], seq 58880:59280, ack 1, win 502, options [nop,nop,TS val 1108721386 ecr 3260075515], length 400
07:09:39.395567 IP 159.203.10.106.22 > 162.243.188.66.14571: Flags [P.], seq 59280:59728, ack 1, win 502, options [nop,nop,TS val 1108721386 ecr 3260075515], length 448
07:09:39.395627 IP 159.203.10.106.22 > 162.243.188.66.14571: Flags [P.], seq 59728:59952, ack 1, win 502, options [nop,nop,TS val 1108721386 ecr 3260075515], length 224
07:09:39.395841 IP 159.203.10.106.22 > 162.243.188.66.14571: Flags [P.], seq 59952:60496, ack 1, win 502, options [nop,nop,TS val 1108721386 ecr 3260075515], length 544
07:09:39.410355 IP 162.243.188.66.14571 > 159.203.10.106.22: Flags [.], ack 59952, win 496, options [nop,nop,TS val 3260075619 ecr 1108721386], length 0
07:09:39.439847 IP 162.243.188.66.14571 > 159.203.10.106.22: Flags [.], ack 60496, win 501, options [nop,nop,TS val 3260075649 ecr 1108721386], length 0
07:09:39.499319 IP 159.203.10.106.22 > 162.243.188.66.14571: Flags [P.], seq 60496:60720, ack 1, win 502, options [nop,nop,TS val 1108721490 ecr 3260075649], length 224
07:09:39.499478 IP 159.203.10.106.22 > 162.243.188.66.14571: Flags [P.], seq 60720:61168, ack 1, win 502, options [nop,nop,TS val 1108721490 ecr 3260075649], length 448
07:09:39.499580 IP 159.203.10.106.22 > 162.243.188.66.14571: Flags [P.], seq 61168:61728, ack 1, win 502, options [nop,nop,TS val 1108721490 ecr 3260075649], length 560
07:09:39.499681 IP 159.203.10.106.22 > 162.243.188.66.14571: Flags [P.], seq 61728:62096, ack 1, win 502, options [nop,nop,TS val 1108721490 ecr 3260075649], length 368
07:09:39.499804 IP 159.203.10.106.22 > 162.243.188.66.14571: Flags [P.], seq 62096:62160, ack 1, win 502, options [nop,nop,TS val 1108721490 ecr 3260075649], length 64
07:09:39.514176 IP 162.243.188.66.14571 > 159.203.10.106.22: Flags [.], ack 62096, win 498, options [nop,nop,TS val 3260075723 ecr 1108721490], length 0
07:09:39.541717 IP 162.243.188.66.14571 > 159.203.10.106.22: Flags [.], ack 62160, win 501, options [nop,nop,TS val 3260075751 ecr 1108721490], length 0
07:09:39.603345 IP 159.203.10.106.22 > 162.243.188.66.14571: Flags [P.], seq 62160:62384, ack 1, win 502, options [nop,nop,TS val 1108721594 ecr 3260075751], length 224
07:09:39.603538 IP 159.203.10.106.22 > 162.243.188.66.14571: Flags [P.], seq 62384:62608, ack 1, win 502, options [nop,nop,TS val 1108721594 ecr 3260075751], length 224
07:09:39.603595 IP 159.203.10.106.22 > 162.243.188.66.14571: Flags [P.], seq 62608:63008, ack 1, win 502, options [nop,nop,TS val 1108721594 ecr 3260075751], length 400
07:09:39.603661 IP 159.203.10.106.22 > 162.243.188.66.14571: Flags [P.], seq 63008:63072, ack 1, win 502, options [nop,nop,TS val 1108721594 ecr 3260075751], length 64
07:09:39.603743 IP 159.203.10.106.22 > 162.243.188.66.14571: Flags [P.], seq 63072:63296, ack 1, win 502, options [nop,nop,TS val 1108721594 ecr 3260075751], length 224
07:09:39.603818 IP 159.203.10.106.22 > 162.243.188.66.14571: Flags [P.], seq 63296:63504, ack 1, win 502, options [nop,nop,TS val 1108721594 ecr 3260075751], length 208
07:09:39.603927 IP 159.203.10.106.22 > 162.243.188.66.14571: Flags [P.], seq 63504:63712, ack 1, win 502, options [nop,nop,TS val 1108721594 ecr 3260075751], length 208
07:09:39.618542 IP 162.243.188.66.14571 > 159.203.10.106.22: Flags [.], ack 63712, win 492, options [nop,nop,TS val 3260075828 ecr 1108721594], length 0
07:09:39.707322 IP 159.203.10.106.22 > 162.243.188.66.14571: Flags [P.], seq 63712:63936, ack 1, win 502, options [nop,nop,TS val 1108721698 ecr 3260075828], length 224
07:09:39.707424 IP 159.203.10.106.22 > 162.243.188.66.14571: Flags [P.], seq 63936:64384, ack 1, win 502, options [nop,nop,TS val 1108721698 ecr 3260075828], length 448
07:09:39.707563 IP 159.203.10.106.22 > 162.243.188.66.14571: Flags [P.], seq 64384:65232, ack 1, win 502, options [nop,nop,TS val 1108721698 ecr 3260075828], length 848
07:09:39.707716 IP 159.203.10.106.22 > 162.243.188.66.14571: Flags [P.], seq 65232:65440, ack 1, win 502, options [nop,nop,TS val 1108721698 ecr 3260075828], length 208
07:09:39.722346 IP 162.243.188.66.14571 > 159.203.10.106.22: Flags [.], ack 65232, win 500, options [nop,nop,TS val 3260075931 ecr 1108721698], length 0
07:09:39.743281 IP 162.243.188.66.14571 > 159.203.10.106.22: Flags [.], ack 65440, win 501, options [nop,nop,TS val 3260075952 ecr 1108721698], length 0
07:09:39.811334 IP 159.203.10.106.22 > 162.243.188.66.14571: Flags [P.], seq 65440:65664, ack 1, win 502, options [nop,nop,TS val 1108721802 ecr 3260075952], length 224
07:09:39.811481 IP 159.203.10.106.22 > 162.243.188.66.14571: Flags [P.], seq 65664:66112, ack 1, win 502, options [nop,nop,TS val 1108721802 ecr 3260075952], length 448
07:09:39.811561 IP 159.203.10.106.22 > 162.243.188.66.14571: Flags [P.], seq 66112:66336, ack 1, win 502, options [nop,nop,TS val 1108721802 ecr 3260075952], length 224
07:09:39.811634 IP 159.203.10.106.22 > 162.243.188.66.14571: Flags [P.], seq 66336:66544, ack 1, win 502, options [nop,nop,TS val 1108721802 ecr 3260075952], length 208
07:09:39.811693 IP 159.203.10.106.22 > 162.243.188.66.14571: Flags [P.], seq 66544:66816, ack 1, win 502, options [nop,nop,TS val 1108721802 ecr 3260075952], length 272
07:09:39.848490 IP 162.243.188.66.14571 > 159.203.10.106.22: Flags [.], ack 66816, win 501, options [nop,nop,TS val 3260076058 ecr 1108721802], length 0
07:09:39.915287 IP 159.203.10.106.22 > 162.243.188.66.14571: Flags [P.], seq 66816:67040, ack 1, win 502, options [nop,nop,TS val 1108721906 ecr 3260076058], length 224
07:09:39.915437 IP 159.203.10.106.22 > 162.243.188.66.14571: Flags [P.], seq 67040:67264, ack 1, win 502, options [nop,nop,TS val 1108721906 ecr 3260076058], length 224
07:09:39.915458 IP 159.203.10.106.22 > 162.243.188.66.14571: Flags [P.], seq 67264:67664, ack 1, win 502, options [nop,nop,TS val 1108721906 ecr 3260076058], length 400
07:09:39.915582 IP 159.203.10.106.22 > 162.243.188.66.14571: Flags [P.], seq 67664:68048, ack 1, win 502, options [nop,nop,TS val 1108721906 ecr 3260076058], length 384
07:09:39.950907 IP 162.243.188.66.14571 > 159.203.10.106.22: Flags [.], ack 68048, win 501, options [nop,nop,TS val 3260076160 ecr 1108721906], length 0
07:09:40.019345 IP 159.203.10.106.22 > 162.243.188.66.14571: Flags [P.], seq 68048:68272, ack 1, win 502, options [nop,nop,TS val 1108722010 ecr 3260076160], length 224
07:09:40.019504 IP 159.203.10.106.22 > 162.243.188.66.14571: Flags [P.], seq 68272:68496, ack 1, win 502, options [nop,nop,TS val 1108722010 ecr 3260076160], length 224
07:09:40.019535 IP 159.203.10.106.22 > 162.243.188.66.14571: Flags [P.], seq 68496:68896, ack 1, win 502, options [nop,nop,TS val 1108722010 ecr 3260076160], length 400
07:09:40.019664 IP 159.203.10.106.22 > 162.243.188.66.14571: Flags [P.], seq 68896:69104, ack 1, win 502, options [nop,nop,TS val 1108722010 ecr 3260076160], length 208
07:09:40.049552 IP 162.243.188.66.14571 > 159.203.10.106.22: Flags [.], ack 69104, win 501, options [nop,nop,TS val 3260076259 ecr 1108722010], length 0
^C
287 packets captured
294 packets received by filter
0 packets dropped by kernel